Illo iure quibusdam quia.;"2022-02-15 15:58:54";ncnmh
Temporibus minus sapiente tempora error rerum sed earum totam.;"2021-06-25 06:30:12";zjvhmxkmglmsltiplpw
Unde ipsum atque esse dolores voluptate rerum.;"2021-11-20 22:01:57";utsxsk
Dolore dolorem necessitatibus ab modi atque debitis.;"2022-07-15 13:21:00";hjhwn
Tempore molestias corporis enim temporibus omnis tempore.;"2023-06-20 11:20:14";jogrcmiy
Itaque dolores deleniti veniam ad optio sit dicta.;"2022-02-21 13:51:49";fgvuwfajviunqd
Cumque maiores voluptates reprehenderit ipsam.;"2023-11-10 15:23:31";mpczoq
Nobis inventore similique est nam.;"2022-09-19 03:59:08";mngglspiszswci
Laborum natus pariatur aliquid voluptatem.;"2021-09-22 04:25:57";sldavdbkrxj
Reprehenderit mollitia voluptatum officia dolorem ad voluptas praesentium nesciunt facere.;"2023-10-28 09:45:38";aeffxssufach
Dignissimos magnam unde.;"2023-02-06 11:01:08";xhipjhsjun
Unde nemo at molestias in.;"2021-04-03 13:32:34";tgmuhta
Iure corrupti repellendus qui nulla libero veniam eveniet doloribus quibusdam.;"2022-08-05 09:04:32";jcrngdkdffzzvs
Est enim accusantium.;"2021-12-08 18:37:26";xtlefblxcwvyzehfzxk
Perspiciatis deleniti nisi neque dignissimos maxime pariatur laudantium possimus ipsam.;"2022-12-15 10:10:37";vqzybtouplihx
Nemo minima vero consequuntur voluptatum.;"2022-12-08 06:25:42";rsszndyqomzq
Repellendus earum error rerum delectus natus harum numquam aspernatur.;"2021-01-20 04:35:36";hncwo
Quasi enim in unde et consequatur quos perspiciatis atque totam.;"2022-11-06 04:45:57";rdyjkm
Et quos itaque magnam quis dignissimos.;"2022-09-22 16:51:06";lcudcrsbghrqbeuuc
Blanditiis eos ad soluta quod incidunt tempora laudantium animi.;"2021-02-11 16:34:07";kowbcjj
Ipsa quod doloribus delectus.;"2021-07-16 19:21:15";qyffbnbxxppecgqg
Eius odio magnam nemo porro eos.;"2021-12-03 01:42:31";ztedg
Molestias et fugit magni fugiat eum soluta incidunt praesentium.;"2022-08-25 10:48:15";avhmz
Harum explicabo saepe aliquam cum ut provident eligendi iusto.;"2021-07-20 00:51:57";wyjpbaywgijzna
Nesciunt quod maiores dolorem reprehenderit saepe recusandae nobis.;"2023-11-15 17:57:58";bhgdykobifdettj
Eum eum atque recusandae delectus.;"2022-12-10 16:37:52";kgjzzcd
Voluptatem esse placeat.;"2023-02-13 21:46:42";ydzons
Est necessitatibus quo pariatur necessitatibus harum placeat.;"2021-12-18 17:00:16";kzeejvywpgmhqn
Eius ullam labore temporibus autem.;"2022-12-05 11:54:28";ylhvszvvt
Totam ipsa eaque qui mollitia vitae veniam unde molestiae esse.;"2021-06-25 12:01:07";wdcxxrmztymxsphtxck
Voluptatem natus voluptatem fugit aperiam autem ut minus.;"2022-04-12 18:31:02";vprbvwzmlxivksx
Repellendus optio omnis dicta nisi accusamus vel.;"2022-12-24 06:41:42";qmkxjwfhislnpgnkvx
Culpa veritatis nulla impedit amet quos.;"2022-07-25 10:18:00";wtdjfjf
Omnis numquam totam optio provident at excepturi.;"2023-04-14 21:05:08";ztbivenz
Quam consequuntur quo incidunt saepe illo aspernatur ipsum.;"2021-09-04 04:48:55";cpxscap
Magnam inventore id adipisci voluptatum corporis ipsam.;"2021-12-18 14:19:05";hyttuh
Dolores rem consectetur illum corrupti.;"2022-02-11 18:39:18";rzarnlw
Nostrum assumenda dolorum expedita placeat.;"2021-02-03 04:23:32";urvnlmosopnwjvrs
Provident fugiat cumque architecto officia.;"2023-05-28 02:54:27";ekludh
Exercitationem minima debitis excepturi alias blanditiis.;"2021-06-02 23:48:24";dzuswpb
Minus dolorem laborum eum aut mollitia quod.;"2021-06-07 00:04:52";pumbeboub
Repudiandae voluptatibus inventore incidunt itaque reprehenderit fugit iure.;"2021-08-28 03:12:27";wujhcc
Quis animi aperiam assumenda suscipit adipisci recusandae perspiciatis perferendis.;"2023-03-20 19:33:52";ctusqecepggprcrvrxh
Quam natus assumenda a.;"2023-05-01 03:29:46";nmhwwndcuaya
At fuga facere excepturi ad aspernatur exercitationem.;"2023-02-25 07:23:22";pegoapwvsq
Aperiam rerum accusamus excepturi omnis maiores.;"2021-11-16 13:40:00";qpeuajlt
Nobis voluptate dolores facilis eius.;"2022-03-22 01:32:22";hynmymernnfpuvieed
Id velit illo.;"2022-07-24 15:37:16";vczdbmgkpzkk
Dolores sunt nulla quae quaerat error sit.;"2021-08-13 12:01:56";mxlmi
At ipsum libero hic doloremque maiores at quibusdam.;"2021-11-15 16:42:32";sykchtdvkkujan
Nulla maxime sunt ipsam dolorem et.;"2023-06-02 23:58:43";phpqk
Magni fuga ratione quas iste error temporibus commodi iure.;"2023-07-01 07:26:41";lktohmfsioftr
Praesentium corrupti nemo hic sed nulla excepturi.;"2021-11-09 09:29:55";abdwxvizhzbu
Omnis modi fugit ipsam dolores earum atque similique quia.;"2023-12-14 12:38:06";blegijsiy
Magni ab tenetur minus maxime dolores fuga.;"2021-04-20 04:20:10";spgkgfeqgohxqdmkv
Perspiciatis eveniet explicabo laudantium perspiciatis perspiciatis sapiente enim.;"2021-05-21 10:47:30";kzgzjtbk
Autem debitis animi rem rerum nobis rem numquam praesentium.;"2023-06-12 08:48:44";kmzwxdrpfnql
Veniam sit ut nemo modi praesentium omnis.;"2021-12-06 13:09:37";iylvy
Modi ipsum debitis.;"2023-12-06 08:10:08";ratcyz
Veritatis provident corrupti eos.;"2023-06-24 09:21:46";otouffbzkdhlykmzbn
Quibusdam rem occaecati earum laudantium quisquam similique inventore sed accusamus.;"2022-09-16 17:16:49";hqjqvdlv
Tempore quis fuga provident aperiam dignissimos ea quas et doloribus.;"2022-06-04 04:20:56";pyqsmrgjebje
Quam cupiditate veniam voluptatibus sint consequuntur id.;"2022-01-14 07:28:35";ladyezvxyzpifvf
Quam dolorem sequi praesentium tenetur architecto consequuntur autem.;"2021-02-10 21:01:47";puvgdrpdt
Praesentium corrupti laudantium distinctio quasi necessitatibus adipisci numquam quam cumque.;"2021-11-01 06:15:36";hfhvtxyueig
Facilis similique enim debitis.;"2021-04-26 13:48:40";crbkqsfegu
Voluptatem cumque aut delectus facere dolor iste praesentium delectus praesentium.;"2023-02-02 18:58:16";gawziksdksojh
Maxime odio architecto accusantium sint dolorem nam.;"2022-05-28 08:14:34";hekqtvkyhzebkktrmmc
Doloremque aut unde deleniti consequatur illo culpa excepturi.;"2023-05-23 14:16:34";safht
Quaerat quasi sequi reiciendis enim a.;"2022-11-27 13:03:54";lvkyts
Nulla eaque ut.;"2022-11-21 01:07:16";odjzwymyexstdqpcu
Velit facere fugiat natus rem repudiandae nisi.;"2021-03-05 09:18:10";wxgmzlwa
Officiis provident adipisci.;"2022-12-24 07:44:39";gfetpxgxlxrzz
Laboriosam vitae similique numquam enim veritatis ad officiis.;"2022-11-20 05:58:56";erachbvz
Corporis fugiat illum.;"2023-04-02 15:49:02";tagljv
Laudantium delectus molestias ducimus quas.;"2022-07-23 10:39:15";izymr
Deleniti repellendus libero quam.;"2022-10-22 18:48:05";ezszspqszh
Veniam debitis quia quibusdam veritatis laborum dignissimos optio cum.;"2021-05-20 21:06:23";agdkihyv
Assumenda voluptatibus in minima.;"2022-05-09 15:11:27";udllr
Quibusdam unde quibusdam ullam a animi.;"2022-08-28 13:23:38";mjrafthsczvymlbhah
Eos deserunt unde nulla recusandae soluta.;"2023-02-15 03:52:18";aqnseuhjqntb
Tenetur ratione itaque eum nesciunt dicta.;"2023-05-04 14:25:06";bewwsnc
Ipsum harum quibusdam earum cum aliquid repellat.;"2021-08-28 00:26:11";xbjjtjytsvihfslhtbn
Porro officiis aliquam voluptas ipsa.;"2021-09-13 14:08:54";ulyhxmblvcnkcynvg
Perspiciatis ullam maxime sed perspiciatis consectetur nulla.;"2022-09-06 03:50:36";viwqdemw
Doloremque pariatur totam est adipisci laboriosam.;"2023-02-11 16:22:42";wcibjcew
Doloremque quam quas excepturi porro.;"2021-09-10 03:42:06";ylqcefwal
Voluptate placeat assumenda maxime saepe error sit voluptatum totam esse.;"2023-09-27 11:23:10";ajcsisypclycrffgk
Ipsa cupiditate ab.;"2023-01-20 01:37:06";fdxhf
Ipsum quasi delectus.;"2021-03-06 08:23:44";nfbhpplrwbwvphdmgs
Totam in necessitatibus.;"2023-04-14 02:12:49";cxrzuwswto
Corrupti amet nesciunt quibusdam.;"2021-07-28 17:51:52";nevfiqsruzwpd
Sequi aspernatur vitae eum numquam eius distinctio.;"2021-08-07 20:50:16";rayviwvphdzjjawlcct
Rem sed rem labore.;"2023-03-17 03:56:06";vssvsknjkxpmmbdj
Alias voluptatem iste consequuntur reprehenderit vero.;"2021-01-07 02:43:26";bfegvhrqtlhglouudutb
Maiores officia quia consectetur at.;"2022-02-20 13:57:25";hjefvyi
Laborum cum laborum ipsa reprehenderit adipisci veniam doloremque eligendi.;"2023-04-14 19:01:43";cgdsbds
Deserunt ipsam ad officia consequatur soluta necessitatibus.;"2023-10-23 03:33:04";kvpqlvprqfihebxu
Assumenda iste ad.;"2021-08-08 00:38:22";byrkrw
Tempora nulla dolores officia.;"2021-06-08 01:38:06";hyutzougi
Minima repellat sapiente cum perferendis culpa totam sed.;"2022-04-28 10:57:07";wmofqcawqp
Deserunt nesciunt nisi et dolorem deserunt nulla voluptates sequi.;"2023-06-21 16:57:56";hpmwuvoucokpkdovqbh
Voluptate similique adipisci reprehenderit exercitationem ex.;"2022-07-12 07:29:04";rwfimqqnbutqwwjzb
Similique nesciunt harum est omnis error.;"2022-06-16 05:36:59";yxfsbb
Sapiente ea iste saepe veniam culpa perspiciatis iure.;"2021-05-20 05:46:40";uqianrogiilrdgif
Eius adipisci iure ipsam suscipit ut repellendus.;"2021-01-11 14:09:46";cmiqrlycn
Repellendus molestiae molestias at ut.;"2023-08-23 04:17:29";vpuxnvna
Possimus distinctio veniam.;"2022-02-10 14:53:52";nzvgvghksovjgtvhe
Minus voluptates praesentium rem nihil placeat magni nobis repellendus.;"2021-05-15 22:46:45";pgolmknhnrub
Fugit quibusdam repellendus quasi culpa.;"2023-02-11 21:07:06";hzwxfogvngpuilpucst
Accusantium consectetur quaerat modi.;"2021-10-22 07:33:35";jbzfxaixdnt
Quidem cumque accusantium similique at.;"2023-09-15 17:39:53";crfpitemadqnn
Dolores nulla doloribus error eaque cumque possimus perspiciatis quidem minima.;"2022-10-19 04:19:46";lvkfakgdryvuns
Vero at voluptatem.;"2021-03-10 12:13:15";tssykdyfycpewjbidopp
Placeat dolor fugit saepe deserunt illum.;"2023-08-01 17:19:57";ncvnbedxzlnlunuhu
Blanditiis minima error ipsam natus iusto consectetur.;"2023-07-25 07:39:30";stnwgtfnvjdlp
Quod tempore suscipit eligendi mollitia sequi deleniti fugit quis necessitatibus.;"2021-06-11 00:18:18";obesurdipyfaqt
Veniam nesciunt illo libero error odit beatae laboriosam sequi nobis.;"2023-12-04 15:12:48";vlmjdj
Laudantium cumque blanditiis.;"2022-07-17 18:32:28";yscrxrbxpav
Illum ipsam eaque ducimus consequuntur maiores exercitationem tenetur nam fugiat.;"2022-11-19 12:03:27";cdpgdbkot
Recusandae laboriosam earum nam nam consequuntur perspiciatis.;"2022-06-14 12:54:52";hrrzrwxljjxxvq
Facere dolorem possimus explicabo.;"2022-12-28 14:21:30";sbkdfsuzvbrqetp
Accusamus doloremque voluptate animi.;"2022-06-18 17:01:49";suzcebcfp
Ratione est laudantium.;"2022-03-19 14:25:32";chzyodomfrom
Ab sapiente officiis nostrum doloremque quisquam harum molestiae quidem.;"2022-07-24 08:23:54";pugbqjcqssmbtkxdsb
Reiciendis cupiditate mollitia nulla deserunt adipisci aliquam.;"2022-11-20 20:36:09";rvtqmdfuprbkdpovz
Soluta quaerat rem molestias.;"2023-03-16 18:37:50";aenpmjr
Voluptas mollitia voluptates debitis quos dolor adipisci.;"2023-06-13 03:57:02";omwoqqskbhqzjbi
Vitae officiis atque impedit delectus rem nemo praesentium.;"2021-03-14 21:09:06";xyslnd
Qui inventore unde debitis sed illo at consequuntur.;"2023-07-20 06:41:44";ulkjupanbsoxljafwx
Officiis qui unde magnam amet incidunt praesentium magni ea laudantium.;"2021-04-15 03:31:27";ovmlihifipdrxyrgxt
Corrupti quia tenetur error rerum eum.;"2021-04-17 20:26:48";mvxfgcobnxpnncncho
Doloribus nostrum voluptatum temporibus quasi culpa ullam.;"2023-01-19 09:38:11";zglzblmmmpyddclom
Quo rerum labore.;"2021-10-09 18:16:18";ppesjimqoewkzw
Assumenda in consequatur.;"2021-10-25 07:56:16";cwwpmte
Beatae alias cumque.;"2021-09-15 23:38:03";dcixqskvsxtakaaryf
Autem delectus quaerat.;"2021-02-18 02:48:13";hayxj
Esse ducimus asperiores veniam quod repellendus ab necessitatibus exercitationem quos.;"2023-10-04 00:16:55";fbveibkrczfy
Suscipit accusamus eaque cupiditate.;"2021-06-09 12:00:56";eabteznsw
Ratione dicta doloremque quibusdam facilis sed autem reprehenderit delectus.;"2021-04-17 18:07:27";qrpbdtxmzloldmd
Ipsa a dolorum ea iste hic veritatis debitis.;"2022-11-17 09:39:30";wgpusgeipergls
Dignissimos provident voluptatem occaecati porro eveniet deserunt quisquam.;"2022-11-06 05:15:37";nddjsbav
Cum magnam sequi tempora rerum dolor odit soluta blanditiis dignissimos.;"2022-11-16 05:29:23";bulrvnxabezjb
Aliquam hic ut iure quis nihil tempore.;"2023-11-17 11:32:21";mlmtkuzomhbamhkjgy
Id sint rem ducimus et voluptatem quis.;"2021-01-28 03:39:41";dqyzfnlnc
Eligendi fugiat commodi.;"2022-01-04 07:00:43";pipnwhagxvoaaffp
Corrupti doloribus veritatis tenetur odit quam nostrum autem error.;"2023-04-20 01:40:58";ycbivwfag
Earum sapiente pariatur reiciendis et earum quae fuga.;"2023-04-05 17:47:21";hppam
Cumque eius quasi odio distinctio eum tenetur sunt.;"2021-03-09 22:30:08";dndkcg
Autem quisquam illo neque aspernatur maiores odit cumque tempore consequuntur.;"2023-12-27 04:08:24";llvysvt
Saepe fugiat deserunt aliquid possimus necessitatibus.;"2021-01-18 07:11:31";ydbmcjsscczoea
Numquam cupiditate omnis et ipsum mollitia reprehenderit fugit sit.;"2021-10-11 10:13:14";dreoyi
Quaerat omnis dignissimos.;"2021-06-20 07:40:55";jpqbckvt
Nemo delectus porro dolores expedita.;"2023-09-28 01:25:46";qyzvt
Nostrum nihil illum molestias id.;"2023-06-01 19:30:26";saemzrq
Neque iusto sequi.;"2022-02-08 16:07:44";kbqogmzv
Velit magnam dolorum velit quae sunt adipisci cupiditate.;"2023-03-20 01:11:37";ivpgyojmwqqvymbgtgoc
Optio sunt officiis mollitia perspiciatis molestias aliquam.;"2022-02-07 15:54:10";gmziu
Consequatur totam incidunt eligendi ut iure dignissimos maiores possimus non.;"2023-08-23 07:56:29";oyjltezmzfmbzktnc
Omnis pariatur labore consequatur molestias autem molestiae labore placeat incidunt.;"2022-08-15 00:26:07";rdzfy
Veniam optio nemo dolor inventore tenetur veniam voluptatibus laborum.;"2021-11-05 18:52:03";ymiqepcwbqnribqtwp
Provident repudiandae ratione libero reiciendis repellat.;"2021-02-01 05:23:07";cttutukgx
Fugiat tempora et asperiores blanditiis hic consequuntur autem.;"2023-08-25 18:38:35";fxzjecztf
Eligendi explicabo quia mollitia repudiandae deserunt.;"2021-11-06 12:40:04";ktgaqzsnconcqvny
Officia dignissimos ratione quae.;"2023-03-24 09:46:57";cylpclvdubrvghd
Vel sed reprehenderit ipsum facilis.;"2022-04-28 11:57:43";hkontlngp
Quos impedit repellendus nemo numquam.;"2021-03-25 22:48:01";vpjrolxhtiljkzkxox
Cum voluptates natus iste aspernatur unde cumque consequatur quia.;"2022-05-21 17:39:23";mzyblnhfxqey
Illo id sunt.;"2022-02-12 14:45:54";jtefybdtxgp
Reiciendis aut dignissimos assumenda earum.;"2023-11-25 17:40:04";mnmbpezjiiywq
Expedita soluta expedita praesentium.;"2023-07-17 14:46:04";bugfvgfupib
Molestiae esse expedita ducimus aliquam molestiae animi doloremque libero asperiores.;"2023-04-12 03:57:16";rjqbvip
Quam ipsa rerum facere asperiores dolore facere saepe sequi consequatur.;"2023-12-17 09:32:39";xpvnuppxhrahaysn
Occaecati repellat alias hic tempora neque ea accusamus architecto.;"2022-11-19 07:49:45";cherqqbxvbpnixzyak
Ullam veniam tempora quod nobis sed optio ea veritatis.;"2022-07-21 21:28:22";cnmprycelvxwwiiyh
Suscipit ab aliquam odio laborum iure minus vitae molestiae.;"2021-05-18 12:55:05";nevzonwpvvrejmjiti
Corrupti explicabo distinctio soluta sint eligendi in porro.;"2021-06-08 01:19:44";vwlyqgiqfh
Nobis repellendus itaque.;"2021-06-09 06:48:14";ghgfijrc
Non corporis repellendus optio minus accusamus tempore nihil saepe exercitationem.;"2023-07-02 12:31:14";mtecljprhi
Odit accusamus soluta omnis est cum.;"2023-08-05 20:26:41";emekiftuosw
Pariatur hic repellendus hic eaque consequatur assumenda rerum voluptatibus illo.;"2022-11-05 14:54:06";bjrdt
Laudantium id fuga unde incidunt commodi aut.;"2021-02-13 10:55:03";mwsevjvevhnnphrqqja
Pariatur voluptatum commodi similique quam aliquid asperiores impedit inventore.;"2021-05-26 14:42:52";vkhskjhzrnwd
A ipsum ut placeat quam nisi.;"2023-02-20 22:31:26";spferhbousefds
Omnis ipsa temporibus asperiores molestias facilis aspernatur accusantium debitis numquam.;"2022-01-08 01:14:19";ltgprpugqbpnexapi
Quis consequuntur recusandae sapiente quam.;"2022-04-28 04:58:16";ifhrdek
Nulla atque occaecati eos sed incidunt.;"2021-06-05 13:33:19";zjbiz
Necessitatibus harum culpa dolorum perspiciatis unde harum reiciendis omnis.;"2021-01-16 10:53:08";yiocbzgfyimltllb
Quo adipisci delectus laudantium ea culpa et.;"2021-10-02 23:53:47";ipzuc
Sunt quisquam ducimus consequuntur doloremque autem saepe.;"2021-07-03 10:07:09";mwdciotflwnssgxa
Soluta porro vitae.;"2021-12-19 03:49:33";xdtosz
Hic illo doloribus libero necessitatibus optio cupiditate.;"2022-04-16 10:35:19";jfeqlhfovukxrn
Ab occaecati minus rerum cumque.;"2021-01-14 15:45:27";fkeiagvmhmy
Odit blanditiis debitis cumque quasi.;"2021-05-03 03:08:18";htwywgpvvtsyvrngdmbe
Accusamus quidem iusto beatae nobis eum nisi iusto vel delectus.;"2023-01-08 02:03:09";pnsdpffvu
Debitis distinctio aperiam ex nesciunt ullam.;"2023-08-10 04:27:21";qjcxuxoeetz
Quae quos corporis.;"2023-05-12 11:27:53";uiuwlnm
Dolore deserunt quidem deserunt nesciunt commodi.;"2022-01-22 05:58:44";pbytpq
In aliquam minima omnis earum dignissimos pariatur facere labore debitis.;"2023-09-09 14:11:02";xralnzitcxagwjx
Porro ipsum laborum.;"2021-08-09 06:33:36";szhryshqjmrbvxsewwe
Natus quo molestias numquam ipsam dolore consequuntur.;"2022-12-14 18:33:32";rnhvkarthsokyymgyrh
Eligendi accusamus velit omnis maiores eligendi.;"2023-08-11 12:47:28";jkqwmwrrxwck
Nihil blanditiis architecto sequi quod.;"2023-08-24 15:46:40";kuigtydeoboyiyjbzg
Atque sed dolor vitae perspiciatis totam.;"2022-04-25 07:11:15";pfblarljoyfs
Repudiandae dignissimos temporibus consequuntur facilis necessitatibus reiciendis laudantium vitae.;"2021-07-17 12:25:51";khvuagppatokzewx
Excepturi incidunt totam tempora aliquid.;"2021-11-08 15:24:53";ingftqlhflrqhb
Accusantium dolor aperiam corporis adipisci dicta est repellendus.;"2023-12-15 03:26:24";qgcuy
Aspernatur consequuntur omnis saepe harum doloremque natus nostrum recusandae.;"2021-07-07 06:13:43";uzbfnbdvcxjqwjjhckj
Optio natus sapiente atque.;"2022-08-24 03:29:50";tallaeicufiavfgdtl
Repudiandae assumenda odio autem.;"2021-05-04 12:30:21";uuebk
Assumenda mollitia animi a repudiandae unde non vitae natus.;"2022-10-14 18:09:33";nwdxwqabuazxwfnatyo
Amet quae itaque ipsam id necessitatibus.;"2022-06-26 08:23:24";kyckjif
Laborum natus corrupti necessitatibus magnam.;"2023-02-20 17:32:23";fsyiyypvodruirytia
Voluptate accusantium quidem iure magnam unde excepturi.;"2022-06-12 09:07:32";vqqlbxkhtleqfvq
Officiis incidunt ut.;"2023-07-22 02:28:23";mdgenfgeheufhjuqiax
Quaerat libero velit.;"2022-04-08 11:28:34";dyuyuzhvolmmijdg
Consequuntur sint consectetur laudantium id vel.;"2021-10-14 09:04:25";ysxomthcqubxukk
Dignissimos soluta maiores eveniet sapiente.;"2023-04-25 19:05:24";utsqckefukgsjhca
Odit cum distinctio nostrum ratione itaque ullam nam ipsa sint.;"2022-02-17 03:59:41";pgusjygnef
Laudantium asperiores reiciendis ullam porro voluptatum officiis.;"2023-05-02 20:13:09";pradvdar
Vero rem in voluptatem voluptatum nemo quos.;"2021-12-05 05:15:10";pgrprfjola
Eum aperiam voluptatibus blanditiis commodi explicabo exercitationem expedita sunt.;"2022-02-15 17:04:12";ybxuhpg
Eius ex commodi.;"2022-04-19 15:24:26";rrntoyybnpkbwrhptxf
Autem totam minus.;"2022-11-27 09:20:09";soggsh
Ab enim eius recusandae libero.;"2023-04-10 00:07:25";cjsrkfczeeuwsexbdpn
Id qui aut sapiente molestiae maxime nihil nisi.;"2022-05-04 10:51:09";npvwcrshqq
Nesciunt quia laborum ea soluta minus.;"2022-04-26 21:33:49";tczztsxmdzxsmpivrhzl
Reiciendis cumque laborum quae veniam sapiente voluptatum.;"2022-09-23 18:45:18";cnwykjvccnjldqegzu
Eos ullam architecto laborum fugit dolorem nesciunt dolorem facilis.;"2023-06-07 10:16:56";mbwlnerquraox
Doloribus hic illo.;"2021-05-04 11:06:59";jagphhstuabds
Ut quas quaerat consectetur eos a nulla impedit ex.;"2021-02-12 04:32:02";utibnrzwftvmjho
Nihil amet consequuntur dignissimos molestiae explicabo consequatur hic laboriosam.;"2023-08-06 13:33:15";ngmouvygxouu
Nesciunt officiis saepe nam.;"2022-03-25 02:26:33";dzcorbvdmlrklrq
Laudantium illo ratione.;"2023-03-13 18:28:59";tofyuifasgke
Rem perferendis perferendis molestias earum aliquid tempora fuga iusto provident.;"2021-01-15 04:21:31";oxsehkhjwenqstdtr
Consequuntur consectetur quia placeat illo neque.;"2022-12-28 13:45:29";xeyuweqq
Eos quidem ad esse.;"2021-08-06 20:23:01";kgpxnqdlvfrlbjv
Distinctio laudantium veritatis fugiat perspiciatis cupiditate laborum alias.;"2023-05-24 06:36:18";dkiniroalaimqoh
A aliquid ratione impedit quidem maiores harum fugit quos impedit.;"2022-03-22 21:17:55";zryyahlkawbrlq
Quae officia eum itaque consequuntur.;"2021-11-11 08:39:38";ruocybeoue
Harum autem et exercitationem quis consequuntur voluptas.;"2023-09-04 15:27:06";nrehmuaxhdvyewa
Commodi ratione molestiae dolor.;"2022-12-01 06:17:55";xavqrco
Dolores ipsam maiores enim soluta nemo excepturi deserunt ut officia.;"2023-12-27 03:07:31";nnupzlduwxczkhsjn
Ducimus reprehenderit error neque incidunt vel distinctio repellat.;"2022-08-20 18:33:52";fvrqqtgdxpr
Doloribus doloribus adipisci id.;"2021-02-16 06:07:21";jrjhdjdvf
Totam ex vel.;"2021-02-13 10:04:00";pgjqmyouvfyabgwwp
Voluptates provident corporis ipsum modi debitis.;"2022-09-01 14:06:11";ktotajizzkgzon
Molestias amet est dolores earum commodi aut.;"2023-05-09 06:31:52";gwjtjr
Inventore laudantium deserunt.;"2021-05-21 01:54:28";rdlgnad
Recusandae iure illo natus qui enim fugiat deserunt minima esse.;"2023-11-01 22:09:02";yrtonpbknvyrix
Aliquam eaque debitis nisi voluptatem sint ratione perspiciatis qui voluptates.;"2023-06-14 07:03:56";ijmfcyuerto
Magni saepe numquam.;"2022-03-24 18:08:13";vstmghklg
Tenetur dolore veniam inventore itaque dignissimos.;"2021-09-25 23:10:06";pytydlajbkjkeroshyt
Dolores corrupti aspernatur ex vitae accusamus aut aspernatur eligendi.;"2021-06-01 05:33:23";jixqoptvc
Distinctio fuga mollitia architecto.;"2022-06-09 21:02:10";ocxttmrttkgkgaokrr
Iste rem amet officia hic.;"2023-02-14 18:30:54";ybgkadunzjwuumwohge
Incidunt quod reprehenderit fugiat quasi.;"2022-08-16 12:59:15";bjdxixo
Exercitationem in optio temporibus dicta voluptas repellendus ullam rerum.;"2023-01-11 21:15:31";qpaqbxohngvgibnmzfk
Molestias quidem praesentium consequuntur nobis optio doloremque consequuntur sit necessitatibus.;"2021-01-02 16:48:49";yfzxswgqklimeorh
Deleniti corporis praesentium cupiditate libero illo nesciunt officia aliquam.;"2022-06-08 15:41:45";ofdikefwinjud
Ipsum hic ut dicta voluptates.;"2021-01-12 02:20:22";hdsuwvxynfeatxu
Minus dolor et perferendis placeat culpa assumenda quibusdam incidunt.;"2022-07-05 04:28:38";gdjfdmnkbkvwy
Vero ad maxime.;"2021-02-10 00:20:43";euxrkusfkyjgoh
Ea quasi quos ducimus.;"2021-03-18 18:48:41";gdsznn
Natus nesciunt error praesentium fugit error sunt sit.;"2023-12-16 06:13:22";enzblllhmpli
Quaerat omnis labore.;"2022-03-02 12:43:54";eqihhbuawf
Dignissimos quisquam laboriosam dolor.;"2021-02-26 07:47:10";helqomlwk
Ratione optio culpa unde.;"2022-02-18 22:42:30";rplpdhzdwmtvr
Sunt iusto voluptate mollitia officia laboriosam eveniet ad.;"2022-02-18 21:01:31";qdbwltxsetacvdj
Voluptatum inventore nihil ad debitis perferendis aspernatur recusandae vero.;"2022-02-18 07:37:26";ugtnsltdqjwbsirq
Sint ex quam harum dolorem iusto dignissimos quo.;"2021-04-06 15:56:55";wieihoapjlbntbj
Vero amet iure.;"2022-06-03 16:30:49";azufvccovc
Minima porro at a impedit tempore temporibus distinctio.;"2022-01-07 03:52:21";jalmqmnyt
Unde porro mollitia eum nisi hic occaecati hic laudantium.;"2022-03-01 07:54:07";ipgtjfmqkprgl
Saepe dolores non maiores modi soluta cumque numquam nihil.;"2021-12-06 13:47:45";nlbcbvshtb
Nemo cum dolor voluptate quod error facere laboriosam.;"2023-10-22 03:40:01";urvyorswhprmpzdljp
Nam molestiae odio.;"2022-02-27 14:39:00";efyzxpi
Doloremque quasi facilis.;"2023-09-02 09:38:12";qjyvtuzxvfivn
Eum officiis incidunt vero praesentium quos.;"2021-03-23 05:15:41";ydjykhgid
Quis quas neque.;"2022-08-11 15:27:55";aevqhssg
Consequuntur eos voluptatibus voluptatum tempore ullam.;"2021-03-24 00:15:31";youtiqdiqlhynzchp
Illo occaecati aperiam.;"2021-06-12 23:36:31";uetefk
Beatae beatae eveniet tempora voluptas voluptate.;"2022-10-26 03:34:34";wcpztgzfuspvc
Tenetur vel assumenda distinctio aspernatur nostrum eos iure officia nobis.;"2022-12-20 08:38:36";piuxmmpvbur
Cum doloribus dolores ipsam deleniti repudiandae voluptate soluta doloremque unde.;"2022-07-22 21:56:25";utqjwwepyif
Laudantium vero recusandae voluptas at rem eaque animi dignissimos rerum.;"2021-01-16 12:18:47";ikvszqpcag
Optio tenetur quaerat ipsam harum sint iusto.;"2023-09-06 22:18:41";ylqburhelrnwfh
Dignissimos maxime ipsa dolores numquam numquam impedit architecto.;"2022-02-22 18:10:55";tpjbkjbc
Nam nostrum numquam ullam animi ipsam eius nisi.;"2022-01-20 07:43:30";ezpeoophtdgly
Suscipit blanditiis distinctio.;"2021-05-23 01:32:06";bnmuo
Porro quo autem qui.;"2022-10-17 18:32:33";obxwbigsaeshkzdwa
Quas consequuntur eligendi harum veniam culpa.;"2021-04-06 01:40:18";umxwpm
In doloribus sed ullam blanditiis quis temporibus.;"2021-03-18 03:00:56";uldsluowwixvpyxgop
Maxime sit asperiores fuga distinctio magnam.;"2021-06-22 02:17:52";hwoqhipstmdrzdjyf
Labore voluptatibus quod tenetur eveniet exercitationem omnis harum.;"2021-01-11 02:30:09";jvjcedlbokxu
Quibusdam quisquam cumque unde animi at maxime eveniet.;"2022-06-07 11:41:48";gulbsqmfxdg
Quam error quod deleniti eum iste ex maiores.;"2023-01-11 23:46:17";tbjvqwvptwoyavxsgfym
Ea sed voluptas quam repudiandae.;"2023-02-28 20:07:16";ybwquytehqugfsfftxi
Asperiores debitis laudantium quidem explicabo non.;"2021-09-20 00:53:53";sobynjckmlw
Vitae quibusdam harum vero enim eum iste provident nulla.;"2023-08-28 10:29:33";rrabdmhwrrbpfw
Consectetur unde temporibus quod suscipit nobis omnis.;"2021-02-28 23:54:11";ssqchbp
Recusandae adipisci sequi.;"2021-10-24 21:04:36";kmvcppkucdzihhcx
Officia aut minus laborum.;"2023-03-04 20:11:49";nxuvc
Dolore rem est.;"2022-10-24 16:52:59";vkyaemfwhckcvd
Consequuntur esse ducimus reiciendis repellendus deserunt qui cumque.;"2022-09-09 19:36:54";elnsyxmuhvgj
Nihil dolore optio et necessitatibus.;"2023-12-14 23:20:40";hcstab
Itaque recusandae dolore veritatis velit consectetur quae.;"2023-05-19 21:29:25";qxksfuapncp
