Explicabo molestias asperiores tempora quis dolorem aperiam magni ipsa.;"2022-02-08 12:28:56";zgzbrixeluqnfuotwh
Maiores unde sequi beatae at animi illum aspernatur explicabo nam.;"2023-01-22 16:33:02";hmsyuimwzpiimfaga
Voluptatem culpa ullam reprehenderit quibusdam harum ducimus laborum.;"2022-07-15 19:01:02";ptajvkokhfo
Nobis inventore corporis explicabo quas iure ex.;"2022-05-03 11:20:21";ocrzkyzrmusuhhakhc
Omnis quis quia ipsum voluptas ad voluptates iste minus.;"2021-11-12 18:44:49";eydcudn
Fugiat velit reprehenderit laboriosam esse voluptates.;"2021-04-09 09:07:05";swhbeiwytakdv
Quasi repellat vero voluptatem modi deleniti corporis facere possimus.;"2023-08-02 12:30:46";wbtsxvnfxlzgqo
Inventore placeat expedita adipisci praesentium.;"2021-06-13 17:05:28";lbbqkdlvwbqjlbo
Praesentium quidem voluptatum maiores tenetur vitae nemo consectetur quod nulla.;"2021-06-16 14:29:07";zaiqoorpu
Neque fugiat nihil molestias error eveniet facere.;"2021-03-20 16:08:49";yihfrqzxpaeldzm
Quam exercitationem a fugiat dolorem beatae doloribus minima.;"2022-01-02 01:20:59";orwamwqpotm
Iure illo voluptas ullam sed harum.;"2023-02-02 10:34:46";tddxmukywtarybdli
Reprehenderit veniam unde quae fugit dolorum facilis laborum animi.;"2023-10-21 12:35:34";wfnsibfnvv
Quos hic molestias in nulla modi officia consequuntur officia.;"2022-12-06 04:11:38";vrhyfgphxrtz
Iste commodi vitae quos soluta consequatur ut provident eveniet.;"2022-06-28 22:01:14";kkfmnb
Pariatur quis quibusdam nobis asperiores enim molestiae temporibus.;"2021-03-16 23:39:47";palbfs
Minima deserunt laboriosam tempora eveniet maiores excepturi.;"2023-09-05 07:45:09";rnazmaoapkjo
Nihil ab nihil maxime cum ipsam veniam repellat.;"2023-03-27 21:03:16";evawmhabadzxjvc
Sit ut earum repellat nam.;"2021-07-07 08:03:55";mokypjgdoue
Aperiam nesciunt odio suscipit.;"2021-04-13 10:58:14";jkbwynloppxschomt
Tenetur dolorem corrupti.;"2022-10-18 02:18:07";tyqrhu
Magni molestiae iste perspiciatis dolores odit.;"2023-06-08 03:42:07";jyxqaqdet
Velit quam fugiat necessitatibus tempore commodi.;"2021-07-15 04:16:49";qezhckgkmtijk
Quidem at fugit.;"2023-05-14 23:50:06";avrxhavyvihcyiyax
Officiis laudantium quasi praesentium aspernatur minus dolor quam.;"2022-09-02 20:53:33";xqpeum
Dignissimos aliquam nam maxime impedit rem optio.;"2022-02-21 12:00:54";tqtjesqzjhnzejk
Quasi sunt a sunt doloremque.;"2021-06-22 08:04:43";urmapeocvlykgk
Quis illum recusandae.;"2021-06-02 03:42:28";xjegxycuumghsmnhf
Voluptatem alias qui quidem iste earum quia quae ducimus illum.;"2022-07-07 09:07:43";pnfvyodyjlgrqkzxabqx
Repellendus dicta quis veniam.;"2022-04-10 11:24:57";syywkbxkfxnywpf
Qui consectetur sit sit atque impedit quo.;"2022-07-01 13:43:01";kamtrxtjwzqit
Quis quasi quam rerum quo accusamus exercitationem magnam deleniti.;"2023-08-19 11:12:20";iawvcsgs
Iusto officia perferendis optio.;"2022-09-19 05:19:49";ochhdclqicqx
Possimus expedita maxime ullam ullam sed.;"2023-11-04 21:30:51";jxkozuuaerbdrxewn
Neque ipsa enim consectetur facere doloremque atque dolor illo.;"2022-01-16 14:55:06";kbpetis
Corrupti nesciunt adipisci voluptatibus odio itaque natus.;"2021-01-07 23:18:28";eojpbl
Iure illum quaerat odit consequuntur quos corporis similique culpa maxime.;"2021-10-16 09:17:41";ygeeyzp
Blanditiis laudantium natus nisi iusto sit.;"2023-08-18 16:52:55";npfnqrhmkqyhkeqjvs
Molestiae atque veritatis iusto esse beatae dolores magni.;"2022-12-01 12:54:59";selkzasddhpfkccgqwoh
Labore officiis maiores enim blanditiis.;"2023-03-16 13:34:42";giuauwie
Porro nulla nesciunt ab animi dolore cupiditate nihil maiores.;"2023-08-18 16:34:06";duqihva
Accusantium qui expedita vitae numquam.;"2023-12-23 12:06:34";wjptqbfdltkavg
Vel quibusdam alias laudantium.;"2023-09-22 16:07:05";zzojbbehmfujyhe
Impedit odio omnis dignissimos.;"2023-06-01 11:33:33";eviulzgfrh
At aliquid perspiciatis.;"2022-03-27 11:46:31";lixwbdiesskyyr
Unde placeat iure voluptate beatae esse ipsa expedita perferendis nostrum.;"2021-08-13 12:40:38";fdiwzlfurtonzqecfcor
Fuga est id modi voluptas libero.;"2022-03-14 13:20:48";irmpzvc
Mollitia ratione quod beatae velit at nobis ratione.;"2021-05-02 11:40:33";rhaxdwqzumrrwhbrub
Eaque cupiditate repellendus laudantium veritatis reiciendis.;"2022-03-02 04:08:11";xakxugctsof
Saepe nostrum asperiores maxime facilis id.;"2022-03-18 12:19:45";nlijajz
Voluptates aliquid accusantium reprehenderit pariatur temporibus.;"2023-01-19 09:51:48";ydhko
Quod atque doloremque repudiandae quasi eos sint esse.;"2022-01-18 11:25:07";srrifglobcdxun
Ratione eveniet veritatis in modi.;"2021-08-26 09:19:16";cixwkttjmdznxksxwbk
Quas architecto porro ex accusamus sunt possimus.;"2022-08-14 12:17:02";arwmlshitqt
Quas provident corporis ipsa perspiciatis sunt aliquid.;"2022-06-06 15:15:42";briposgv
Sunt illum perferendis dolorem totam eligendi sapiente perferendis id sapiente.;"2022-10-01 16:01:19";ilnsxfreexn
Expedita molestias officia enim voluptatibus alias adipisci.;"2021-11-11 10:15:22";qkyukmc
Nulla quidem aliquam quo odio.;"2023-09-06 23:16:41";vlmhjzqcbqdx
Voluptatem harum veritatis.;"2022-10-10 11:54:53";jjqtzftuzjqkyu
Sapiente recusandae provident doloribus natus quasi laboriosam corporis.;"2021-08-09 21:55:38";pwboeiww
Placeat dolore dolor est soluta nulla ad in commodi.;"2022-06-08 13:28:25";jdowujucxzhvob
Rem nihil alias modi eveniet quaerat similique aut.;"2022-03-17 03:37:33";jncdongog
Quibusdam facilis ipsum eaque ratione omnis.;"2021-08-27 19:29:44";izuvqvedykrseqgo
Ad assumenda consectetur atque fugiat esse dignissimos nam.;"2022-10-17 04:59:54";fogitrokbp
Doloremque quod dolores facilis accusamus blanditiis hic dolorem nulla.;"2022-07-28 16:59:00";mxqftxutwojsduhteuhs
Ipsum quas animi repellendus cum tenetur est.;"2023-05-18 12:50:40";znaewqdrjbnvpmh
Reiciendis voluptas sapiente aut ipsum accusamus.;"2023-09-12 05:05:17";rsqjybqkv
Occaecati deserunt saepe non culpa quam debitis.;"2021-02-26 23:15:40";xcyghbykv
Amet quidem sed dolor nobis quas nesciunt tenetur.;"2022-12-20 15:35:58";mxbhjkkealiqbf
Rerum quam accusantium quo.;"2023-03-23 15:02:53";mvojtqgugtlxjhqwohpt
Necessitatibus amet laboriosam fuga cumque porro nam.;"2022-10-11 02:17:34";fberkkyby
Distinctio quis delectus quibusdam sit.;"2023-03-10 14:51:33";tlfygyzicjrpini
Reiciendis dolore iusto quidem ullam sapiente.;"2021-04-10 11:00:47";nzftpvfzvrkdytpwnhu
Tenetur aut vel.;"2022-10-27 02:10:26";wdcnwzqqmczptn
Repudiandae illum perspiciatis.;"2021-11-23 14:35:32";hvgxdxgbkmazsgz
Ea nesciunt necessitatibus labore perferendis temporibus ipsam sint.;"2023-03-16 05:21:54";tgxblf
Accusantium harum accusamus explicabo eos sed.;"2022-02-01 09:09:32";uagncwsas
Eum ut corrupti dolorum minima veniam quisquam.;"2021-05-19 20:52:42";iaizgv
Necessitatibus cumque excepturi temporibus.;"2022-05-13 17:10:17";rbhxrrneskosqiee
Incidunt mollitia eligendi perferendis eveniet aliquam.;"2022-12-23 13:10:57";rzlzqkz
Eum veniam id voluptate vel ducimus odit quibusdam.;"2023-07-16 10:45:09";yzmjkznval
Quos quo sequi eaque eius debitis.;"2022-05-04 16:00:33";akauyltj
Corporis earum placeat exercitationem nam rerum porro qui totam.;"2022-07-11 13:34:43";tcbwvo
Repudiandae laudantium tenetur voluptatibus quidem dicta.;"2022-06-04 12:07:06";edfuabpyrkjsj
Earum quis odio voluptatibus dolorem inventore assumenda.;"2021-04-10 20:53:43";ulunladnunrtgpdomaf
Quibusdam laborum ducimus accusantium pariatur cum dignissimos.;"2021-08-08 09:16:27";idihyxkgj
Nam quod quisquam doloribus accusantium sit.;"2023-02-04 20:41:42";dribhfpfjcjrp
Iusto consectetur voluptatibus maiores ab esse voluptatum veritatis.;"2023-02-13 05:31:30";lxhnsynsntnknymrcg
Quos repudiandae commodi assumenda cum magni in.;"2022-09-12 13:34:20";ndzbcbaxswamlwromxx
Nihil labore dolorem ipsum molestias.;"2023-06-14 22:59:06";qvfxfibfym
Similique neque nemo fuga totam.;"2023-05-24 07:42:01";zvsyaicn
Dolores quas est aspernatur est recusandae.;"2022-08-25 17:25:17";xhcrzajzbrwntmdndiy
Voluptates perferendis sequi.;"2022-02-24 02:47:09";afamtcahehtv
Voluptates dolor nihil cupiditate itaque.;"2022-03-03 12:11:49";crtpboridpwbcpp
Quas sed nam.;"2021-05-10 19:48:39";fncpxjtbrdeevs
Libero velit eum sequi labore dolores doloremque voluptatibus fugiat.;"2021-02-27 15:52:17";qzrojmifim
Totam fugit maiores iste neque officiis minima non maiores sapiente.;"2021-10-03 15:35:02";ipqkvvqhbxjjoekb
Molestiae nesciunt ex dolorem.;"2021-09-03 03:14:11";lxpcdpzyvz
Corrupti amet reiciendis accusamus accusantium.;"2022-10-09 23:44:31";gddgdmbbpiyyowcoxh
Ad fugiat mollitia ducimus officiis aliquam.;"2022-03-18 08:24:21";vplet
Et corporis quo cupiditate incidunt officiis in.;"2022-05-22 15:29:13";csymwhsdicyx
Quibusdam soluta facilis excepturi excepturi.;"2021-10-02 18:39:32";iadjvlkrxfvmxaaczqnu
Beatae quod delectus accusantium laboriosam asperiores deleniti iusto.;"2021-05-16 08:19:42";linxalvphvfunq
Numquam pariatur dignissimos recusandae atque atque quis quisquam perferendis.;"2021-12-28 21:31:01";sqnwvrrvvwjyhmmdyodm
Debitis nisi in ut.;"2021-03-13 07:25:45";nxiqjq
Voluptate sed ducimus at optio.;"2022-02-18 01:55:42";ysegulqfrecxifwynsxm
Fugiat excepturi dolores facilis asperiores praesentium optio molestiae voluptatem.;"2022-04-16 21:35:34";tguphnk
Nesciunt reiciendis earum ducimus perferendis.;"2022-10-23 04:38:13";zheesiljndxmitmfgw
Amet consequatur ullam ab nisi dolore harum nemo.;"2022-12-24 04:18:44";ncnbtbd
Illum dolore nobis natus quae soluta sed.;"2021-05-19 21:02:39";cvitybhubsdjh
Aliquid eligendi autem.;"2021-02-27 14:23:22";helliygtzfbckbvvrwv
Alias velit repudiandae quaerat asperiores.;"2021-11-04 02:20:22";suytqy
Dolor distinctio maxime repellat quasi.;"2022-11-24 15:34:02";zijitfw
Iure tempora rem consectetur hic.;"2023-05-20 12:42:19";dvmdgo
Saepe cumque molestias.;"2023-04-24 23:54:08";ijcznwbwmkaitn
Suscipit debitis perferendis ipsa nemo eligendi deleniti quod laudantium.;"2021-02-18 07:53:40";mgivtotpgecxeqleqh
Sequi ut sunt perspiciatis exercitationem quas accusamus aperiam quos.;"2021-02-10 21:12:09";lsunkvfgraim
Mollitia porro doloremque placeat alias numquam.;"2023-08-17 06:08:47";tourxvr
Aliquam odio modi ad veniam velit deserunt.;"2022-11-12 11:34:58";adaurhhvhneucbhu
Quod debitis libero facere.;"2022-03-10 17:17:51";fpoxvl
Fugit ipsam sit ipsum corporis delectus blanditiis quia sit nemo.;"2022-04-10 14:23:40";ymeuvbhqa
Minus accusantium quibusdam reiciendis suscipit consequatur harum aperiam mollitia dignissimos.;"2022-10-02 00:34:54";oqradgodnfeq
Veniam exercitationem voluptates aperiam corrupti ad minus modi inventore.;"2023-08-22 03:58:06";wdxqqlfkvbdnws
Consequuntur excepturi voluptatum suscipit quae debitis.;"2023-08-26 13:04:28";varrxtrojlbzbvjknnq
Est itaque illo voluptate fugiat sed eveniet laudantium.;"2022-10-01 04:14:06";zfcziitdaawghaes
Ratione quaerat reiciendis culpa consequatur laborum sapiente vitae.;"2023-03-14 08:43:28";mexatwlc
Aliquam quam magni totam blanditiis explicabo.;"2023-04-07 08:19:29";rjhdplsrpcxrf
Nesciunt suscipit blanditiis doloremque reiciendis accusamus.;"2023-09-19 21:35:06";mwbbw
Neque fuga recusandae assumenda reiciendis aliquam veritatis at.;"2022-03-19 18:09:03";acbglfpuxajfn
Saepe repellat reprehenderit est rem.;"2021-08-06 01:24:48";hrvepcedln
Asperiores molestias nobis dignissimos maxime deleniti earum.;"2021-12-11 16:22:57";lhvpbcfmxbaewmbiqh
Nostrum eos suscipit ea perferendis voluptates delectus sequi blanditiis.;"2022-04-26 17:40:55";ublewcc
Iusto at nostrum voluptatibus adipisci non laboriosam.;"2021-12-17 13:56:37";jnwlmgie
Adipisci cupiditate illo tenetur repudiandae id officia.;"2021-09-12 09:10:17";hlvyibthgljieguju
Corrupti iure saepe velit assumenda maiores eaque occaecati.;"2022-03-11 03:15:21";stpcjdivpnb
Modi delectus possimus animi sit quos illum vel iste voluptatem.;"2021-06-19 01:28:49";hhlfdczmlfkgd
Quam quos aperiam exercitationem.;"2022-07-18 22:02:08";izyniohqdaqqt
Quod adipisci deleniti labore architecto atque dolorum eligendi ab delectus.;"2023-02-17 04:02:34";xlxoeejtqkpulsdrroh
Hic ipsam cum omnis nobis exercitationem porro.;"2022-11-08 07:18:17";rxscwqtyll
Rerum repudiandae accusamus voluptate mollitia sit quisquam unde sequi.;"2023-04-06 12:14:52";ssmidhp
Voluptate dolores exercitationem ipsam.;"2023-09-01 01:35:08";zwgucxyvnkqrcuvlwr
Quos laboriosam magni porro perferendis dolore repellat accusantium.;"2021-08-11 05:44:45";uijcihwswmwptmyqnqn
Quod accusantium numquam nemo esse voluptate rem id in nobis.;"2022-09-17 21:27:32";bnvbpkrobnlfvffn
Consequuntur itaque velit ea voluptatem aliquid autem harum.;"2021-09-05 15:58:51";oufwohrkahs
Quae dolore tempore harum modi laboriosam doloremque distinctio debitis.;"2021-05-15 18:07:41";rakwdwnfrvqwecnrmd
Consequatur optio rerum nam.;"2021-01-16 05:32:29";qbowkkrwolv
Totam eaque cupiditate repellat dicta et.;"2021-01-26 08:21:29";fszyqrlcrq
Ratione iste maxime officiis voluptatibus.;"2022-12-21 05:02:41";ievuznmmcbgrr
Perspiciatis quisquam officia suscipit.;"2023-04-16 19:47:11";oqtlihecyxjc
Dignissimos facere iure dignissimos non totam.;"2023-07-27 02:14:26";njaeffyciljzemd
Optio illo non alias id quaerat aut quod.;"2021-08-24 02:39:49";ifahaxvcjgfg
Blanditiis nostrum ipsam aliquam maiores numquam deserunt corporis.;"2021-10-01 05:29:51";sxkvuuwpdx
Ullam vitae tenetur vitae.;"2022-01-22 09:06:00";rdnuttyncmvdpbflxki
Provident unde ipsa neque nulla tempore dolorum.;"2023-12-28 04:25:32";ekwziyhpnrnsxjgufrfh
Magnam quisquam excepturi.;"2023-11-20 23:54:36";rluywrwziynklmpxmbh
Ex nostrum est.;"2023-07-10 17:50:48";kpjseyqm
A odio eveniet temporibus.;"2021-09-11 00:18:08";gziupnzyu
Architecto molestias veniam.;"2022-08-14 00:08:40";irhibhl
Eveniet labore consequuntur natus aliquid.;"2023-06-07 22:44:01";vqshfeeqxfifrbwr
Repellendus inventore architecto hic saepe iure laborum.;"2021-02-10 11:18:28";bjfymhmtre
Voluptas soluta reprehenderit.;"2021-02-01 22:44:41";ufomnfspei
Ex fuga nemo.;"2023-09-03 12:28:24";xxfmwwzktmuetjq
Id ipsam cum qui maxime necessitatibus fugit hic.;"2022-07-25 16:08:59";nppzaakpdetgkpddrox
Officia mollitia maxime saepe nulla minus optio harum eaque.;"2021-10-25 23:14:58";fbzxu
Placeat quis occaecati reiciendis suscipit eaque odio repellat delectus.;"2022-09-01 06:38:11";eqtmduhhdweuqymaqnf
Perspiciatis quaerat minima aliquam velit molestias atque aliquam.;"2022-09-15 00:53:01";ecjfzq
Adipisci et quaerat ipsam illum.;"2022-07-26 07:11:41";dgtomzgifss
Odit quisquam consequatur impedit dolores.;"2023-09-23 10:40:34";ftusmee
Consequuntur dolorum iste occaecati.;"2021-11-09 23:22:33";klogsqwtlidyiwpn
Enim pariatur nisi sequi porro excepturi.;"2022-04-04 05:47:53";iegrakhbrkmmjaklzny
Quo porro sunt sint.;"2022-08-24 04:29:52";gwhvvrfiqbcc
Autem perspiciatis nemo voluptatibus est ad esse blanditiis perferendis ex.;"2021-01-13 06:27:03";gugzkugidlgjpe
Pariatur suscipit architecto voluptatem nesciunt.;"2022-01-08 00:15:38";dytpgmdmitclgvn
Cum in ipsam sed maiores cupiditate.;"2023-05-23 16:51:46";bdgezfetpcflxww
Numquam facere rerum amet consectetur eligendi nulla commodi.;"2021-07-18 19:05:26";lugpzs
Explicabo dolorem deleniti tempora quod reprehenderit.;"2022-12-25 15:20:47";ibhbb
Dolorem sunt natus officiis explicabo alias.;"2021-12-25 11:35:43";mhvrq
Blanditiis reiciendis tenetur autem modi nulla iusto.;"2022-04-27 15:03:59";bnqmvuinbfjhgb
Similique eum rerum accusantium maiores minima.;"2021-11-06 06:00:11";obrxtiukbgazaxkksp
Aspernatur doloribus rem autem esse delectus optio accusantium.;"2023-04-24 06:32:09";peixxbhdnhacedm
Eius iste ducimus velit optio.;"2023-03-24 18:00:43";oauezcc
Ipsam repellat officiis.;"2021-08-02 13:02:29";nbmbfqafrokfxrjplt
Numquam optio fuga minima quaerat iste.;"2021-01-09 01:38:48";oohfi
Ea at praesentium.;"2022-03-05 14:13:05";hxztcgc
Tenetur tempora nihil voluptates quas quae ullam necessitatibus.;"2022-12-15 23:13:49";nlngp
Commodi dignissimos veniam enim optio illo blanditiis unde ea.;"2021-07-07 16:35:03";oohykduw
Debitis molestias libero aliquid nam quia quibusdam adipisci explicabo nihil.;"2021-07-24 13:36:34";iwircnnqjayuakzgxc
Sed magni saepe sequi aliquid incidunt quasi laudantium molestiae est.;"2022-04-12 04:04:21";qyiddhinmguzfucm
Quo nisi maiores.;"2022-03-18 03:40:37";wqkgelxbnlujhixxvk
Magnam eaque exercitationem quos quam rem et iusto.;"2023-10-06 16:00:31";gfscw
Veritatis expedita debitis harum illo pariatur laborum.;"2021-10-06 05:12:39";jqarcwdaaaobzgf
Ab deleniti et dolorum.;"2021-04-16 05:28:09";zgmrepdtnrgncmlgmkw
Fugit quaerat a accusamus fugiat officiis.;"2022-03-28 03:04:43";peaayycerq
Corporis ea enim quidem laudantium iusto aspernatur facere incidunt.;"2023-12-13 12:45:36";zpwgrzwx
Laboriosam qui dolor commodi odio.;"2023-06-14 17:12:47";cwgqrpefyutad
Quis nihil voluptatem nisi harum delectus quibusdam.;"2023-07-15 13:38:00";hvoemci
Error cum veritatis optio.;"2021-11-06 13:16:55";nmrdnwbixhxowhlq
Quos veritatis explicabo.;"2022-09-14 23:07:55";xoohfc
Temporibus recusandae nobis fuga consequatur impedit.;"2023-03-23 18:03:37";zipsledyvvpbadnewrk
Eaque esse incidunt velit nemo officiis.;"2021-08-02 03:55:59";zwumfvfcqqxbw
Similique earum fuga voluptatibus sunt similique ut tempora debitis sequi.;"2023-01-16 22:32:24";dicouslknfwzhqjz
Repellendus aliquid dolor voluptates omnis labore dolor dignissimos odio.;"2022-07-12 06:43:55";faafgbpfnembylncmnh
Numquam officia dolor consectetur beatae illo autem cumque ipsam sunt.;"2021-08-13 14:16:59";jutavyhdtnperfepcu
Fugiat doloribus nostrum.;"2022-01-21 06:50:14";lpwclu
Sint ex repellendus nisi ut.;"2023-08-11 05:05:46";mlhstgqolewbcpx
Deserunt numquam reprehenderit quasi voluptate voluptatem impedit.;"2022-04-16 10:05:32";wydbsibkapc
Ea dolorem tenetur sed labore.;"2023-12-09 18:20:49";swnlgkvamkywpxlog
Expedita quae ullam nesciunt at debitis.;"2022-06-28 18:30:28";dfxaxeltofy
Tempore facilis vero tempora.;"2023-08-01 22:25:19";jzkexdpjs
Cum corrupti et veritatis eius.;"2021-02-22 00:53:59";rszfkrz
Et quis expedita eius nostrum corporis.;"2021-08-10 00:28:38";nnovwj
Aliquid reprehenderit ipsum aspernatur maiores.;"2021-12-18 08:24:42";edjsyddbkyeu
Vitae voluptatum sed dicta officiis praesentium illum quis incidunt corrupti.;"2022-03-11 00:36:52";ivpcf
Numquam tempora distinctio minus ipsa molestiae.;"2021-12-26 18:24:09";toxskllnok
Eveniet ex consequuntur atque dolor perspiciatis voluptatum.;"2021-03-20 21:35:20";vuelrqmoccuj
Quasi minima dolore molestias.;"2022-06-09 21:27:52";gmlgfuy
Dolorem nisi dolore id nulla debitis labore iusto hic.;"2023-09-20 04:58:06";vwcnbtqtssfc
Dolore placeat libero.;"2022-03-27 10:33:22";uyddnfrfu
Voluptatem non nihil autem vel.;"2021-11-14 08:18:45";iltnvtwzgtpczals
Numquam nostrum dolores ipsa explicabo provident tenetur dicta repellat.;"2022-05-08 21:39:07";rjuqo
Sunt quam nihil temporibus non.;"2022-06-11 05:53:06";vdwysxoq
Id architecto blanditiis nostrum aspernatur nostrum.;"2022-07-06 13:25:15";urzkdijpwwx
Iusto enim placeat quibusdam.;"2023-07-02 14:22:15";nbhvtmsxoxrik
Voluptate cumque esse.;"2023-01-19 22:27:20";iwsvheiwe
Eaque impedit voluptates consequatur.;"2022-02-24 05:33:38";vqdbstojojdnt
Reprehenderit corporis blanditiis.;"2021-08-21 19:48:09";zlgilfitaxbry
Rem beatae minus veniam saepe quisquam sequi expedita.;"2022-08-02 15:42:54";lxkkufoerwkukrpd
Illum saepe delectus.;"2023-07-18 18:45:50";buhqvscjsbvzmurcnci
Explicabo adipisci incidunt rem fugit aperiam.;"2023-08-11 15:27:16";zjvnsxr
Distinctio minus eveniet deserunt inventore aperiam iusto nesciunt.;"2023-06-12 19:46:42";vooodbbqdw
Excepturi facere minus quod natus et minima dolorem.;"2023-12-01 19:57:22";wydzntqqxzpmwg
Nihil non dolore laborum corrupti.;"2021-02-19 07:52:53";dusingcurcg
Occaecati quia corrupti nostrum mollitia quos impedit perspiciatis expedita illo.;"2023-01-24 07:45:22";kmuolamzk
Quisquam illo libero dolores aperiam dignissimos temporibus nulla.;"2022-12-26 19:27:54";hlljoqgq
Nihil est quisquam dicta nostrum sunt rerum quibusdam sapiente doloremque.;"2021-07-10 12:38:30";ocjvirotncxehhk
Nam dolorem fuga eligendi sequi blanditiis excepturi.;"2023-02-12 07:35:37";sjwjgw
Sint ex odio voluptas.;"2023-12-26 04:52:49";addsahsvguals
Commodi ipsam possimus explicabo.;"2023-07-11 13:58:48";kylep
Dolores quo dicta earum animi unde.;"2021-02-16 13:27:42";zpteqi
Accusamus pariatur veniam esse odio nulla ea fugit tempora nisi.;"2022-11-19 08:12:26";dfczrdigmte
Hic sed cupiditate tempore unde labore voluptatibus.;"2021-08-08 10:43:28";oyovnqqkvx
Sunt voluptates rem vitae doloremque corrupti veniam voluptates.;"2021-06-17 18:15:39";eaifq
Possimus at repudiandae in nemo quos unde excepturi ratione pariatur.;"2022-11-05 23:11:41";zamumdfcjsszyvxy
Laboriosam quos maiores non voluptatem exercitationem aut delectus quia deleniti.;"2022-09-11 13:31:32";vvgea
Ipsam reprehenderit modi eaque nostrum sunt.;"2022-11-03 13:09:37";knsljdk
Eum commodi recusandae magni eaque omnis unde qui nostrum dolor.;"2022-02-11 05:51:34";lttjtezhqcoimtxcw
In amet in temporibus nobis hic at totam culpa quis.;"2022-08-15 15:08:52";qmdryykgdqhpuwcuwv
Laborum adipisci quis magnam.;"2023-04-26 22:57:31";wcsvceblkojydxrwau
Architecto dignissimos sapiente ad.;"2023-08-04 21:50:18";wgesynuekfkd
Aspernatur asperiores quae.;"2022-08-07 14:17:30";egqseckjauzblhl
Error sed minus sed.;"2021-04-26 08:15:04";pterydndotwkc
Dolores nobis unde sunt consectetur.;"2021-04-19 12:20:11";stgncoqsytvq
Sed repellat veritatis soluta non voluptatem.;"2021-02-07 11:55:44";lcdpraxa
Iste asperiores numquam saepe quidem ullam tempore nobis nihil doloremque.;"2023-08-17 03:29:29";xjdaodycjkjawhucyc
Velit itaque magnam rem culpa praesentium odio minus ipsa quo.;"2023-12-09 21:50:35";bvpeoxzhmossadgsbgw
Animi cum exercitationem exercitationem assumenda amet distinctio voluptatibus.;"2021-02-02 09:32:29";hgsnwdzxeknegv
Fugiat odio tempora quisquam delectus similique optio.;"2022-11-14 16:17:53";bhvhibcfqpecji
Alias incidunt rerum et praesentium.;"2022-07-04 02:30:35";ffoxb
Laboriosam impedit aperiam quibusdam fugiat.;"2022-06-12 15:57:13";hgvmwbtpggrnsle
Dolorem hic tenetur officia magnam voluptatem et ipsam.;"2021-08-27 22:14:28";pktdjevcverz
Blanditiis accusantium facere animi ipsum.;"2021-09-11 15:35:40";dfrydeivfvfq
Autem debitis voluptatum suscipit veritatis iste deserunt repellat ex inventore.;"2021-08-19 11:05:46";lxxktwsojz
Iusto sit ipsam ex quisquam aspernatur suscipit ducimus dolorum architecto.;"2023-09-18 16:59:28";gcrodcsije
Beatae numquam dolorum optio est.;"2022-12-17 22:15:09";lfbaaairwxkfkldjatl
Esse iure ipsam architecto ullam.;"2021-06-13 10:08:21";elqislylszrpk
Quae explicabo architecto ipsam eius vero saepe animi.;"2023-07-16 00:00:46";cotocxyzffnwf
Delectus provident molestias aut vero sapiente.;"2021-08-23 09:53:41";untprinsvbvlzlis
Ut distinctio at voluptatem perspiciatis.;"2021-09-17 15:44:37";xcjyckokhtgtsjkqc
Tempora doloremque accusantium doloribus voluptatem perferendis minus quia explicabo.;"2022-12-24 20:13:43";qadtjvvcbh
Voluptates et deserunt corrupti voluptatum eaque fugiat molestiae.;"2023-06-27 15:06:58";inpyccjjaj
Id alias voluptates libero iste ullam distinctio.;"2023-03-27 17:58:59";sngsmlzeunqyvvnkqtnx
Eaque suscipit quod facilis quod odit necessitatibus sequi maiores officiis.;"2022-09-06 17:32:47";lntzfoj
Amet modi harum.;"2023-03-20 23:37:33";ftpxnkajvgizirywypul
Iure tempora nam odio suscipit exercitationem illo.;"2022-01-04 06:13:10";gadubonvejafv
Nemo voluptas mollitia odio impedit id sed.;"2021-05-07 12:25:30";qdjnscyzlbvn
Iusto labore reiciendis optio temporibus deserunt facilis amet.;"2023-12-28 02:11:56";jikelveqrtwzre
Provident aut qui modi harum nisi totam suscipit nihil odio.;"2023-01-13 16:37:24";ddbvxli
Dolorum esse temporibus ipsam ea dolorum animi.;"2022-02-05 17:05:27";uxauohiz
Facilis nisi fugit impedit nihil omnis officia incidunt laudantium.;"2021-04-22 16:48:46";xcefuumcw
Nesciunt voluptates iste asperiores porro officiis.;"2022-10-18 18:09:31";myzafomtvduzqkily
Quibusdam unde esse rerum aperiam tempora nemo.;"2022-11-09 23:34:10";qpxsqchismkaluofy
Dolores blanditiis velit eum saepe praesentium est dignissimos.;"2022-12-05 20:50:32";mwpcgizycjuk
Fugiat eius commodi commodi.;"2023-02-27 01:32:13";vwgxwmofpxcimrsber
Iste quo quaerat quas neque provident animi.;"2021-10-14 15:24:29";rjnrjqn
Laudantium odit odio id dolorum inventore libero aliquid.;"2023-05-11 01:47:59";fppvubkhkjvmulmbigsp
Fugiat magni facere id aliquid reprehenderit qui recusandae minima distinctio.;"2022-11-10 20:04:13";ngmtzd
Voluptatum error labore labore nobis aliquid.;"2021-07-23 18:36:12";tpfpsplxn
Facere iure laborum quam.;"2022-09-14 18:19:35";wdkldwugeyz
Mollitia tenetur similique hic quas voluptas eveniet incidunt velit fugiat.;"2021-08-01 11:00:23";uvkfwyzwakbxcm
Atque sunt nostrum quaerat.;"2021-11-24 04:09:51";gqzqnrkaplmdl
Quibusdam quisquam explicabo culpa vero officiis similique asperiores nam vel.;"2023-02-08 21:28:21";lrcwuaop
Veritatis labore molestias.;"2022-05-26 18:39:48";ijikfvokr
Corrupti debitis modi in occaecati.;"2023-05-27 07:21:56";aklnokah
Doloremque corrupti ullam sit.;"2022-03-27 21:44:27";yyxqwm
Vero nisi nesciunt dolorem porro sit laboriosam neque.;"2021-08-08 22:43:14";efronvycvh
Laborum odit maiores optio magni odio cumque occaecati nisi deleniti.;"2023-07-08 03:26:56";luriuquychkmuxiwciz
Minima totam soluta culpa debitis esse at facere illum.;"2021-10-24 07:02:05";ctddxfknfgtv
Ex atque nesciunt.;"2023-10-14 03:40:50";sqkbxagzokoyvb
Minus officia quae tempore dignissimos sed numquam aut.;"2022-05-04 18:00:06";dpznaij
Fugiat ea ducimus qui.;"2021-08-09 07:23:15";qnzzw
Odit rerum officiis aperiam ullam reiciendis.;"2023-12-25 19:33:28";wazvydbtr
Aut expedita molestiae ea tenetur nam esse atque odit rem.;"2022-06-02 21:36:58";xpekvyxtlvkwzmtmrvh
Enim delectus et exercitationem minima molestiae debitis blanditiis iure.;"2021-01-24 19:20:02";zemiucgerfypk
Laudantium aspernatur possimus distinctio aliquid possimus exercitationem dolore quibusdam quas.;"2021-01-27 13:13:25";ryzfghwnbb
Maiores qui officia atque reprehenderit laudantium nam commodi.;"2021-10-05 13:10:55";iumqihkahnmxpjga
