Quidem maxime vitae deserunt eius dolor.;"2023-06-13 18:32:43";cgxpdqapmufbudhcoxs
Natus delectus iusto ipsam.;"2022-05-27 22:10:55";bnxjnklbkwyp
Deserunt distinctio consequuntur fuga voluptatibus debitis sunt ducimus quae in.;"2022-06-08 04:23:49";xqibryzn
Modi magnam laudantium repellendus odit eligendi voluptatem laborum.;"2023-03-09 02:43:54";kgcqijvhcwkeho
Optio saepe est assumenda error quas.;"2022-11-18 10:52:52";ttbsmpfg
Dolores officia nisi earum dignissimos eum similique totam.;"2023-07-28 09:46:23";bpepfhhyqnk
Maiores esse ipsam autem consectetur omnis tempora unde quae.;"2021-07-01 21:33:41";hlrptm
Esse consequuntur commodi cumque cumque tenetur.;"2021-11-25 10:07:02";ndddhlfscjzweyiigurb
Ipsam officiis ea porro molestias velit qui.;"2021-04-19 22:47:56";jszkyz
Et deleniti molestiae vero quis qui vero perferendis aspernatur.;"2022-07-21 00:46:26";timtjfwedm
Fugit repellendus blanditiis repudiandae impedit distinctio numquam possimus.;"2022-10-18 20:33:05";jeuaqvjmpdvhaqt
Unde itaque illo vitae nihil dignissimos ducimus laboriosam quos minus.;"2022-04-18 02:24:44";kxidks
Magnam pariatur impedit doloremque beatae iusto quos corrupti laudantium amet.;"2022-08-10 20:02:26";rblhxhcwoant
Repellendus illum minima quasi accusantium quas at ea dolore incidunt.;"2023-08-06 01:40:29";pufxvfjcvvwosm
Repellendus maxime ducimus voluptatem dolor quasi fugiat sunt.;"2022-09-20 17:53:02";pilkcfggqoahmmmh
Corporis culpa perspiciatis accusamus dolorum enim earum nam.;"2021-05-14 11:29:56";ghvzdefojh
Labore qui ullam.;"2021-06-22 11:45:47";rfdouv
Impedit provident fuga totam recusandae.;"2023-09-03 10:18:55";vvuwygi
Commodi eaque culpa eligendi rem nihil nulla laudantium maxime ipsam.;"2021-10-17 21:57:10";idyelrrstyg
Eum soluta dolorum ipsum quis rerum voluptate corporis.;"2021-09-23 17:55:56";fpsbvoyj
Aliquid id sapiente sed.;"2021-04-24 05:05:31";vqwdguogfgigypf
Sint rem molestias.;"2023-07-16 23:08:10";mxcttruarhvnbnnzrhuj
Voluptate dicta consequatur.;"2021-10-18 00:51:41";ydhravusruvsizo
Omnis ab ab.;"2023-09-27 05:24:27";phurdycvomyaymig
Illo quaerat in.;"2022-03-20 19:24:50";bzxovsmztbuhjclz
Aut dicta exercitationem voluptatibus.;"2022-03-07 16:24:04";rcxfrksxnhuwgchibfc
Sequi quibusdam ut mollitia repellat consequatur commodi.;"2023-06-19 17:52:42";wxdtmqtnevngyhzwg
Quod placeat architecto ipsa explicabo.;"2023-04-27 07:55:55";dzrdpe
Qui officia vel iure saepe pariatur aut cum et.;"2023-09-16 16:06:11";zfcloxxtvb
Harum quis beatae possimus animi accusantium asperiores.;"2021-12-20 05:43:47";snjhzacrlubsjiausb
Modi numquam accusantium quo architecto non possimus.;"2021-04-20 13:24:42";xtymaihnsxc
Repudiandae reprehenderit sequi magnam libero aliquid veniam velit.;"2023-12-01 07:09:10";nfflhknyisvf
Asperiores facere vero ex aperiam necessitatibus.;"2023-01-08 08:17:18";sgzyufodkxrsuhb
Illo sequi earum culpa itaque.;"2022-03-23 12:01:07";kvntksd
Molestiae quidem itaque quidem.;"2022-02-11 18:06:20";mqnvxwuuxeff
Sequi nostrum non laborum sequi expedita error blanditiis autem.;"2023-09-02 06:55:41";eyafpzzpkon
Suscipit culpa ut dolor aliquid culpa quam blanditiis.;"2023-12-05 09:26:36";kctnqzu
Voluptatum libero aut consectetur tempora laudantium tenetur delectus.;"2022-07-06 15:46:19";jdxfwpzbywd
Magni debitis eos voluptate quam officiis amet consequuntur aut.;"2022-07-12 02:29:53";msebzbfgoaazfmrl
Error laborum accusantium tempore.;"2021-10-12 23:03:38";jbjlfefbva
Deserunt at ad ipsam distinctio.;"2021-01-28 18:12:55";rbvflwyqnrmhs
Dignissimos voluptas illum quia voluptates minima hic illo qui.;"2023-07-02 05:43:24";ikkhg
Molestias temporibus distinctio quos natus pariatur earum rerum nam.;"2023-03-28 00:51:07";fchkpmkstgmbauuhbzcv
Vitae amet temporibus blanditiis quas eos.;"2021-10-28 06:44:09";vmshasmjtyymvhrbbq
Praesentium corrupti soluta dolor dolorum illum maiores eligendi voluptatibus.;"2023-05-23 01:47:03";hdthszkbdxlwyq
Soluta culpa illum aut sint excepturi perspiciatis.;"2022-01-06 06:33:40";epxfgloha
Accusamus dignissimos atque quaerat ipsa distinctio eos optio vitae quo.;"2021-12-15 08:47:34";zakwhogob
Cupiditate quos blanditiis quis qui eveniet eligendi dolores.;"2021-03-02 17:25:40";dqzmdzfh
Minima veritatis recusandae ea totam pariatur voluptates consectetur inventore facilis.;"2022-05-13 23:57:31";azjwdvnszatwngvl
Assumenda hic numquam ullam consectetur qui illum ab sed harum.;"2022-12-25 05:05:32";uckwsfvsfazdaxdvlil
Sed ullam itaque iusto alias libero enim ipsum repellat.;"2023-01-22 05:49:29";fqjafe
Natus labore facilis culpa optio corporis a.;"2023-04-18 01:56:57";hyrjckoabpsaofz
Adipisci voluptatem at error aperiam atque.;"2022-08-08 16:21:10";arpxksbhip
Excepturi necessitatibus architecto officia rerum accusantium deserunt omnis.;"2021-11-21 22:38:41";qezlkapne
Ad sapiente ullam fugiat sed quisquam eius.;"2023-03-25 13:11:51";fprkiaxisnaueo
Ipsum ipsum expedita eaque fuga ab numquam voluptate doloremque tenetur.;"2021-10-10 10:19:32";xfzwsxv
Dolores esse perspiciatis neque.;"2021-05-17 13:29:15";vgfqfk
Unde accusantium similique veritatis atque.;"2022-06-21 15:47:06";pvrwihgjnsmnostcqgm
At molestias aspernatur.;"2023-02-09 15:49:27";otxtuhcquqejathsovm
Placeat accusantium cum amet animi at nihil deleniti debitis dolorum.;"2023-11-08 08:15:15";aoexiccdnzjijjau
Aliquam maxime ipsa dolores.;"2022-07-08 21:32:09";ygncvdorfmexur
In explicabo provident libero repudiandae.;"2021-11-20 01:02:11";vbnlok
Fuga maxime enim corporis voluptatum saepe.;"2021-03-24 05:59:26";soone
Architecto eos recusandae molestiae fugiat.;"2023-03-01 04:28:39";jxflhybsckmgqa
Totam quia unde modi.;"2022-05-07 15:54:02";utegyga
Doloremque corrupti reprehenderit omnis animi aspernatur harum culpa.;"2022-12-14 09:39:36";kqpxzwzcoycmyakijf
Nisi ea quos quod assumenda in suscipit ipsum nisi ea.;"2023-09-18 11:12:04";zjkayvonkxyf
Accusantium quisquam repudiandae cum.;"2021-12-19 02:13:12";gxgsyjjkbptk
Eaque aut aliquid ullam hic hic.;"2023-05-27 18:17:26";tmhhsaeis
Doloremque aperiam laborum libero dolores.;"2023-03-28 16:35:52";xbqjxnbjjzc
Non eveniet recusandae quidem quaerat ab eveniet fuga similique ad.;"2023-06-18 13:32:55";wyudepqdhbq
Maxime dolorum nihil magni.;"2023-11-02 02:06:35";aeacjnjagcy
Quos eos quo cum vero libero vero facilis reprehenderit distinctio.;"2021-08-13 15:22:06";hjamgu
Incidunt sint enim animi.;"2022-03-02 03:29:12";hlvxukhz
Totam accusantium molestias fuga aperiam molestias esse tempora.;"2022-08-14 19:12:04";zhoyna
Eligendi sint repellendus eveniet sequi.;"2021-02-22 01:20:25";ncxbjgxue
Facilis officiis assumenda.;"2023-10-26 20:11:24";oojwrglwtqglvx
Quis nulla illum tenetur explicabo.;"2023-10-02 17:51:27";umkdc
Dolor suscipit assumenda est dolor commodi porro.;"2023-05-04 14:09:39";sdryhygv
A magnam corporis distinctio.;"2023-02-19 04:10:02";hbatl
Exercitationem velit maiores repellat aut ipsa sit cumque vel.;"2022-04-12 17:09:28";dbtytzkol
Aspernatur fugit iusto sed minus.;"2021-08-19 13:50:37";jryos
Delectus commodi maxime nisi.;"2022-07-09 00:24:18";glcipvrbhmhunwcs
Delectus laudantium maxime.;"2023-07-24 16:06:54";dlgssskiztrvjl
Hic excepturi aspernatur quisquam velit aliquid quod.;"2023-05-11 14:16:39";njxujcgpw
Asperiores fuga tenetur nam occaecati necessitatibus facere.;"2023-06-22 09:24:50";bpngppylnje
Sapiente ipsam esse cumque ullam placeat voluptatum veritatis non dolor.;"2022-05-27 06:39:38";kphsiftk
Magni perspiciatis voluptatem facere similique harum ipsam.;"2021-11-15 17:29:21";bthgyrmla
Ducimus fugit expedita dolorem tenetur.;"2022-05-05 09:15:57";nqssulv
Distinctio ut perspiciatis repellat ducimus nihil quod laborum harum facere.;"2022-12-23 06:32:15";vyjpthdettxe
Reiciendis magni aspernatur officiis beatae amet aperiam quaerat.;"2022-07-20 14:49:16";femfoanumisni
Mollitia quas quo.;"2022-12-19 19:53:54";azwmbtztsmal
Esse id atque adipisci porro molestiae laudantium tempora temporibus.;"2022-09-24 05:20:51";yavtbv
Dignissimos asperiores fugiat saepe ipsam blanditiis ipsum.;"2023-06-13 03:25:12";injtvdbp
Facilis consectetur autem optio fuga.;"2021-12-05 07:45:54";jcolpfqe
Quasi fugit totam.;"2021-11-08 09:21:49";wfutgyjxavpxqrl
Sapiente animi dolorem consequatur aliquid.;"2023-10-05 02:24:37";wipgzeeubbyojyd
Eaque sint ducimus sequi aliquam libero esse suscipit officia.;"2023-08-26 21:50:21";tkqvtpojyihim
Reprehenderit occaecati blanditiis tenetur nulla blanditiis id officia.;"2023-01-17 10:34:38";vidrbfgrgxomb
Illo velit corporis modi ipsum veniam officia ab.;"2022-12-16 03:15:06";uobqj
Est ipsa optio.;"2021-05-22 09:42:06";pcdrukzkp
Necessitatibus nostrum labore vero repudiandae dicta voluptas ratione cumque adipisci.;"2021-11-09 00:09:04";ywvwvg
Impedit assumenda odit expedita repellat omnis similique voluptates quo incidunt.;"2022-03-24 09:12:26";ddwuauezrpnliugcdoz
Animi eum ullam ad provident eligendi nisi dolores.;"2022-02-26 16:58:42";xbfsg
Fuga ut rem.;"2021-09-22 02:24:39";zpqslczhjiidriou
Ullam reprehenderit ipsam alias cumque repellat.;"2022-10-25 22:36:01";qjblfh
Nihil itaque ipsum nemo.;"2021-06-03 07:59:15";xkcwrlbirbltpxywjn
Inventore repellendus quisquam possimus ea id quos error.;"2021-03-06 14:00:21";jsprchkvxx
Facere animi cupiditate totam necessitatibus.;"2021-01-01 06:14:04";epwdshfrvnf
Id incidunt accusantium placeat quasi suscipit nemo molestias.;"2022-03-12 23:24:17";dkdsbtpawhimp
Ipsum porro assumenda quisquam minima architecto.;"2021-05-23 17:19:59";elqdkpmu
Molestias sunt dolores inventore fuga quae nemo error maxime.;"2021-06-21 07:59:08";rttheozbanbtt
Voluptate iste quae dolorem nobis dicta unde incidunt.;"2022-02-17 23:14:23";bazprpunxucx
Asperiores quia voluptate omnis mollitia voluptatum dolore delectus quo.;"2022-01-09 17:57:12";orvufvepiohr
Numquam placeat temporibus quisquam corrupti autem.;"2023-03-17 04:44:55";kncpxskzvyxgcxxknukv
Dolorem cum nobis eligendi sint maxime repudiandae quae recusandae.;"2021-01-02 11:09:24";qumeqjnkx
Cupiditate voluptate delectus recusandae nobis dolores aliquam.;"2021-12-11 01:34:31";miqeeuluti
Minima animi molestiae fugit ex odit unde temporibus explicabo.;"2021-02-01 04:17:25";ceegmyhnpemkvebvf
Error ullam voluptatibus eos ducimus voluptate quae minima adipisci blanditiis.;"2021-09-28 13:26:09";yzwpzmaejvqhxbbmfrn
Vitae quo porro ipsam cumque sapiente aperiam dolores.;"2023-03-06 13:04:45";bcsnreqkdgj
Sit fugit commodi ullam deleniti error.;"2022-10-01 23:03:01";szzqyptuwdrxsgb
Perspiciatis aperiam velit magni.;"2023-11-08 19:48:29";ffmht
Nobis eum eum in repellendus quod.;"2021-06-22 05:25:41";izluhmtguirzcrxb
Soluta ut accusantium aspernatur aperiam ad rem ratione nihil.;"2023-07-10 04:56:07";efchoxmvcffmqfsqpmh
Debitis repudiandae ad labore tempora adipisci deserunt ducimus vel.;"2021-12-19 05:03:59";znlekzgg
Provident qui consequatur quisquam reprehenderit consequuntur assumenda ipsa unde cum.;"2023-11-16 17:44:30";dftvlpxlwqmlntox
Ab veritatis quibusdam animi consectetur error accusamus rerum voluptas ratione.;"2022-02-18 14:13:15";ohjuvwmdmrikvzuwmt
Eveniet repudiandae natus non.;"2022-03-26 09:35:53";pbrrgatwu
Quod ipsa perferendis neque exercitationem eius voluptatem illum molestiae.;"2022-07-24 08:08:58";tyixebhbf
Consequatur necessitatibus harum consectetur sapiente.;"2021-05-02 09:02:11";qytiizfsgmi
Quisquam doloremque alias cumque corporis fugit.;"2023-06-13 09:22:43";dqbmqixieoug
Tempore velit rem quo quis velit.;"2021-05-22 00:23:59";xlocvbsnwcoxz
Nostrum occaecati culpa ab totam nulla error.;"2023-04-09 08:26:11";jegxwjeusar
Soluta vel vel debitis aperiam.;"2022-03-13 12:08:41";rjptif
Unde alias perferendis eveniet.;"2022-01-10 21:51:20";fmvbrpr
Aut doloribus praesentium voluptatum recusandae minus voluptatibus modi ab eius.;"2022-05-22 21:23:35";cbpoujydouekrpum
Qui delectus in exercitationem tenetur.;"2023-02-05 05:16:26";pusnqpw
Quibusdam accusamus corporis esse vitae eos soluta iste eum dicta.;"2021-09-06 04:29:23";afwghewlfcybsbqt
Assumenda modi quod at.;"2021-08-03 23:09:52";mtksafaoezmutr
Necessitatibus soluta aut rem voluptate.;"2022-09-01 08:49:36";ngooizvw
Quod iste praesentium animi provident.;"2021-10-28 08:24:10";umuqpgvcitxcyfy
Doloribus debitis consequuntur suscipit doloremque consequatur fugit commodi.;"2021-02-11 04:15:56";dzetdavqpixbbuokzxab
Repellat adipisci fuga excepturi laudantium illo officia accusamus fugiat vel.;"2021-05-03 07:03:34";bymfmybdjvyhybs
Quas odio tempora repellendus ullam.;"2022-01-17 02:14:43";slkkljwbxnr
Assumenda nam rerum commodi architecto voluptas enim.;"2021-01-24 22:09:41";lerhhgzmqke
Quod libero aliquid in consequuntur accusamus sapiente quaerat voluptas.;"2022-09-17 16:44:00";eozshwmadorfd
Repudiandae debitis ipsam tempore repudiandae facere dolores.;"2022-02-14 00:56:57";kjjvhkcttdoaihfz
Ipsa qui eligendi eaque.;"2021-10-05 07:16:53";vdfwerk
Ipsum corporis soluta iusto sint.;"2023-07-05 05:23:09";tdvnejm
Dicta nihil deleniti.;"2021-03-09 08:29:05";beofse
Distinctio assumenda molestias ea deserunt minima.;"2023-04-09 20:29:44";rkunayqrxd
Vero magni quas voluptatum.;"2023-10-24 21:53:43";nsxtfarcbeztoci
Quas repellat aliquam voluptates aliquid.;"2021-09-09 11:22:16";zipymdojwejvu
Nemo soluta architecto repudiandae autem perferendis quisquam sed dolor.;"2023-03-15 21:21:54";txuhdmbe
Veritatis explicabo dicta molestiae perferendis nobis.;"2022-07-18 09:02:59";pkmfpkrtyezgsxyth
Impedit quia distinctio ex dignissimos cumque officiis.;"2021-10-10 13:39:09";latmyjgebcb
Rem dolore dicta nemo ipsam.;"2021-10-27 15:40:36";vjuuybtoinsxffy
Blanditiis libero a animi unde vero sunt.;"2021-06-20 12:40:50";gwhftixluhothfoyhtwh
Odio fugiat molestias repellat laborum tenetur sunt dolorem aliquam.;"2022-10-14 04:15:12";pmotexraxhm
Provident ullam repellendus voluptates similique eius voluptatum soluta.;"2021-09-14 11:24:53";szacibrbvdeq
Eligendi rem eligendi provident totam voluptatum odio praesentium.;"2021-10-14 00:02:13";vouzwsff
Corporis accusamus vitae.;"2021-08-09 20:37:42";rsxeqkzcmuopfbywqs
Explicabo debitis vel itaque.;"2023-12-14 06:41:13";frxokqox
Tenetur dolores deleniti.;"2021-10-15 23:13:53";oskdgwqqwjv
Ipsam minus porro magnam necessitatibus.;"2021-07-25 15:27:26";ibaeycswv
Optio nesciunt quidem eaque facere vero.;"2022-03-24 14:44:08";zaluaqdp
Sunt dolorem tenetur officia alias optio eveniet explicabo.;"2023-01-27 18:49:46";wbtmffalevipgyo
Atque suscipit iusto est laborum dolore ratione voluptate assumenda doloribus.;"2021-03-11 01:02:02";munntrzv
Ullam velit repellat aliquam.;"2021-03-07 12:37:32";pxoddrtcmof
Atque blanditiis facilis rerum itaque reiciendis minus illo.;"2023-04-23 15:03:49";sgafu
Est vero assumenda nemo.;"2023-06-09 14:47:21";xeattyoqqkp
Perferendis suscipit laborum labore reiciendis iusto alias odio repellat.;"2021-10-26 15:39:15";rjuhap
Amet numquam dignissimos minima atque.;"2022-08-19 04:18:06";twmgvkzvwzemwzdgxt
Nisi molestiae saepe.;"2021-01-28 19:03:19";lrjnoxa
Dolore maiores earum quae quaerat et dolorum pariatur dicta.;"2021-04-05 06:07:59";bwdegnlhcjuvksprkyd
Soluta id minus.;"2023-11-02 14:47:43";pspfgjozhdqyv
Blanditiis provident delectus.;"2023-09-26 01:45:47";kxpkujnesl
Iste quis voluptas accusamus quo.;"2021-02-23 12:48:53";lfhicfukl
Repellat accusamus perspiciatis.;"2023-08-22 05:45:44";idtqnjmlguvbzmbfuec
Nulla ut dolores iste neque repellat.;"2021-04-23 21:03:53";vbmgbylizhxrw
Libero ullam sed accusamus doloribus.;"2022-02-03 23:04:02";sxbqjorb
Id eum quibusdam quod corrupti ab quidem fuga eos quis.;"2022-02-02 22:05:03";rpmpvrmifszxzb
Necessitatibus nostrum suscipit optio minus sit explicabo modi.;"2021-08-11 09:07:06";zayhxmfuofewusrf
At earum unde voluptatem iusto fugit mollitia eos.;"2021-02-03 14:44:56";yrvctpsdhautkyc
Voluptatem sed enim perferendis repellat eius culpa consequatur enim.;"2023-07-23 00:55:08";wcykkhhqtmcvlwkkxc
Magni vero pariatur.;"2022-03-09 02:10:10";ruqrtminsqliczymelu
Accusamus nobis repudiandae expedita est possimus ullam.;"2021-07-25 04:22:58";irtwwykvblkisvt
Placeat quia in.;"2021-08-25 18:54:01";tnxjdc
Consectetur facere suscipit.;"2023-06-24 16:39:36";vbeaykgwi
Similique deleniti odio atque dolor corporis ducimus quod.;"2023-03-24 07:17:59";xoiqoot
Quaerat autem ullam dolore explicabo saepe cupiditate molestiae explicabo animi.;"2021-01-26 20:47:48";xjonkfwvie
Reiciendis doloremque aliquid nam culpa rerum nemo animi quas.;"2023-01-15 03:41:22";ykbobtwccyzpztthj
Quia aliquid laudantium nisi excepturi.;"2022-12-14 13:51:28";iessyaktmkwfbcbl
Dolores culpa laboriosam voluptatum.;"2021-07-10 16:49:21";ibdivak
Voluptate esse eveniet facilis eos.;"2021-12-15 20:12:18";gkzggxvssxirpofzggn
Neque temporibus nisi nemo sunt ex laboriosam quod ut omnis.;"2022-12-04 11:53:25";znnkramcrmkvgkvitr
Libero est vitae cumque repellat sunt et totam eligendi.;"2022-12-16 00:25:59";pfihzmnlmwin
A aut voluptatibus magnam.;"2023-11-05 03:29:20";rnbjuqnbv
Doloremque minus qui fugiat doloremque perspiciatis mollitia optio ratione.;"2021-04-16 04:46:17";mlavkakqldps
Saepe odit ad exercitationem.;"2022-08-14 02:32:36";hvtdabq
Facere eum eius.;"2021-05-26 06:34:05";erspqrxvtk
Accusamus modi quod.;"2023-01-03 05:10:51";mltusui
Neque officia vel iure expedita occaecati vero error ipsum inventore.;"2022-03-17 05:07:40";kjjmzpmgknkasvejtrfj
Tenetur laboriosam perspiciatis minima rem expedita aliquam quos expedita dolor.;"2021-02-23 12:44:37";jeqeyexepketefrzp
Distinctio provident nihil rem eum accusamus molestiae nemo.;"2022-01-14 22:36:05";wkdcopard
Rerum iste accusamus consectetur dolor ex asperiores blanditiis accusantium sint.;"2022-03-10 13:07:47";wuekpldjydziyhbuukte
Sed magni impedit porro repellendus corrupti ullam quis porro doloremque.;"2023-06-06 09:53:40";mklxdviqnkgbmlyxazk
Fugiat velit repudiandae dicta.;"2021-06-16 11:18:06";ibnwzedwlnwfpnhksz
Illum consequatur eaque alias qui rem.;"2021-01-17 16:45:51";bhywaqulb
Fugit harum magnam porro.;"2021-07-02 00:10:09";cuagemcczgjymx
In nihil reiciendis.;"2021-05-14 02:31:09";jdssi
Laborum deserunt explicabo quia velit ut veniam.;"2022-01-03 00:25:34";ihtcmlwzrmaybchoqmz
Quo earum esse fugit.;"2021-12-15 06:11:43";wowwkqfhb
Repellendus suscipit optio.;"2023-04-01 08:05:09";cogrfh
Aspernatur aliquid soluta hic.;"2023-04-20 17:12:52";miepdsisq
Quos suscipit possimus blanditiis aliquam.;"2021-03-09 23:32:47";kstadn
Distinctio ea accusamus asperiores adipisci excepturi odit qui doloribus.;"2022-02-04 19:30:11";dumawkb
Dignissimos hic sunt deserunt illum quos nesciunt labore.;"2022-05-11 09:23:27";awgclilsazwkafvaul
Tempore ratione ipsum molestiae dolore voluptatum exercitationem.;"2022-11-06 02:29:49";jqbibvhtfzcqrlsbshho
Est laborum soluta dolor architecto soluta ipsam.;"2022-04-26 22:11:52";ppidtiwwwpnhcpli
Dolorem quia iste odio incidunt quae voluptates consequatur.;"2023-07-15 01:09:37";dhocrrewwogticaey
Maiores voluptas ratione voluptates commodi nemo.;"2023-04-19 23:13:56";jidopdvbsbevyg
Iusto voluptatum voluptates rem quod laborum vel asperiores fugiat.;"2022-06-07 07:11:08";hqsul
Voluptates facilis a ullam fuga cupiditate id asperiores velit.;"2023-10-08 10:23:47";pzfbuddryuiy
Voluptas hic doloribus asperiores aut nostrum rem.;"2022-02-24 05:23:52";vmxzgcarb
Nam architecto voluptatibus magni.;"2023-11-03 09:18:45";valpwmx
Qui error quisquam nobis.;"2021-04-26 23:54:42";ggsczlotakur
Et optio velit cum facilis tenetur ratione doloremque.;"2023-07-20 14:33:32";abhhupqyyfhzxg
Minus voluptas cum eaque numquam soluta possimus.;"2022-09-16 17:53:44";jvrvncrjleoitza
Voluptatum fugit autem molestiae nemo culpa ut sit.;"2021-11-19 19:29:01";ayadobugwjeksbvjqf
Nam nobis quo necessitatibus.;"2023-08-20 08:22:34";zdvka
Voluptas cupiditate impedit eum cum dolorem.;"2023-04-06 20:52:00";qcfboeyetzgny
In voluptas quam dolor occaecati.;"2023-04-04 00:54:56";srdwlrzpvxpwybbnfhdv
Sint et ullam molestiae esse dolorum ratione commodi possimus.;"2022-12-09 07:14:57";ruigdigfecajmjkbj
Cupiditate ratione praesentium voluptatibus ullam ratione dicta est in.;"2022-05-27 08:53:53";wuiittf
Sequi quisquam ullam a repellendus sed.;"2023-02-25 22:50:56";xlpwzbawu
Deleniti nesciunt dolores nisi distinctio.;"2022-11-22 04:48:56";zibygbhdjuwecdmu
Error eligendi corrupti corrupti sit officia veritatis.;"2021-02-17 08:03:21";cadefobmcedxlnnk
Rerum quam natus nemo inventore.;"2021-05-25 19:53:46";rybjkczqhbgdb
Provident molestias possimus.;"2021-01-22 15:46:36";kzheczygogoa
Vero voluptate laudantium perferendis numquam atque blanditiis.;"2023-04-05 19:04:22";pxyghowjlabymmglm
Modi laborum magni ut quasi.;"2021-03-05 22:34:45";hrjnsvmfbplmr
Ullam voluptate sint deleniti ipsum aspernatur tempore harum.;"2022-05-02 07:56:35";fzqipvfodobcdy
Dicta ullam ipsa optio perspiciatis hic similique ut rerum modi.;"2021-09-16 12:58:31";meionclxeky
Tempora animi amet iure.;"2023-12-11 07:15:09";fbxhj
Veritatis reprehenderit quo nam deserunt.;"2022-01-24 14:36:46";fyzvrizqluhgbewa
Dolorum perspiciatis deserunt magni.;"2023-03-17 23:51:58";zjgzfrqt
Saepe voluptates rem tempora pariatur blanditiis.;"2022-04-11 16:59:37";koxhzvk
Fugit mollitia autem totam consequuntur.;"2022-05-12 20:13:42";xnvzuhsrbmwxukde
Occaecati aperiam natus officiis.;"2023-02-27 21:57:10";qycqovj
Est ea ullam possimus.;"2022-03-08 16:15:33";dmldofqsl
Eius corrupti incidunt et.;"2021-04-06 21:02:57";idxrbeaggb
Culpa eius eius.;"2021-06-01 23:53:39";tbagwbf
Quibusdam iure consequatur veniam numquam laboriosam veniam eaque iste.;"2022-08-20 05:43:53";apwfnczkpfdqce
Perspiciatis impedit id dolore.;"2022-06-14 09:24:29";mautyvcjpjg
Enim similique nihil dolorum hic non dolorem.;"2023-04-20 16:04:10";euckm
Voluptatum cum saepe commodi ducimus libero voluptatum illo.;"2023-05-02 05:57:15";jlawchvcc
Provident officia iure illo dolore autem sit blanditiis.;"2023-05-26 16:36:00";zdykexbgxpalpniqn
Voluptatem ipsam perspiciatis blanditiis quod unde quidem.;"2023-12-21 16:15:43";wmpxhxygvwccx
Perferendis nesciunt veritatis iusto tempora praesentium accusantium nulla cupiditate.;"2023-05-20 15:24:06";ojrsqzroim
Porro officia exercitationem perferendis illo asperiores autem.;"2023-12-14 18:12:16";ocdhzviwypjrps
Explicabo iusto vitae voluptate corporis mollitia cupiditate totam qui tenetur.;"2021-07-14 03:25:54";zrbzsqf
Aut veniam illo laboriosam temporibus voluptates maxime quasi impedit.;"2023-10-05 06:23:23";xpiswwrnufqj
Accusamus a assumenda fuga nam hic minus atque qui similique.;"2023-12-02 14:15:25";mfuxeoyuilllet
Exercitationem velit ipsam quod labore quas.;"2021-10-23 04:29:00";bwbsrssniijpdxyte
Numquam minus dicta ratione animi sequi aut molestiae.;"2022-02-22 06:08:22";xyzmpmvdxwrmbcxbafa
Iusto numquam qui id perspiciatis ea.;"2021-04-11 16:17:57";rnptikmlpukul
Cumque molestiae blanditiis nulla iusto quidem impedit nihil.;"2022-01-19 08:27:08";ohxbfgemqnry
Veritatis deleniti facilis cum ea atque hic consequatur.;"2023-11-27 01:43:52";vfivseibmmnsqdylcnfs
Maiores perferendis blanditiis magni voluptatum eius esse nihil.;"2023-09-06 06:05:25";gfhwrfe
Eos quam dolor nulla provident.;"2021-09-23 20:44:40";ouhemzhpmxqwehhrjo
Fugiat reprehenderit explicabo sapiente.;"2021-01-18 03:56:10";yfdzuinkpxynschjesce
Aut nihil aliquam doloremque id harum.;"2023-10-23 08:25:04";hjxxinudv
Pariatur ab quam nobis.;"2021-09-07 22:17:52";malrrxpqs
Quam iure veritatis deserunt ab explicabo exercitationem pariatur vitae modi.;"2022-12-25 03:24:23";iavfpg
Nesciunt dolorum quidem.;"2022-11-03 01:47:05";rschved
Soluta temporibus a nulla.;"2021-07-22 21:58:02";ghkem
Veniam porro sapiente iure amet tempora assumenda aliquid.;"2023-02-11 17:25:27";qnqgg
Quos quod tempore.;"2021-02-08 19:54:36";ihlgcaizjmchcmoxgby
Tempore iure sint unde.;"2022-04-12 08:06:26";dgnxn
Totam eius maxime mollitia.;"2023-08-16 20:26:05";jkuzpmuwt
Praesentium ea consequuntur ipsa.;"2023-01-15 11:59:50";kvspvwhafhgdybkrs
Perferendis nam nihil ipsam odio enim repellat delectus quia quas.;"2021-07-10 03:50:25";qwlpljsgmcqjypjm
Temporibus laudantium repudiandae.;"2021-05-16 20:04:32";ovpsbujbpuitxncnql
Enim iusto eveniet asperiores maxime corrupti animi.;"2021-03-08 23:22:58";npmksehbyplvxnkbya
Tempore adipisci est facilis necessitatibus possimus possimus.;"2021-02-19 13:43:23";hjbnb
Asperiores dolores occaecati.;"2023-09-03 01:37:34";nbuqqvpssdlbk
Nobis incidunt cumque nihil veritatis voluptatum reprehenderit consequatur.;"2022-11-18 20:42:46";skvwslxasxdt
In mollitia libero.;"2023-11-20 23:27:36";okbkxyaphptrkclcsszu
Autem cum mollitia aspernatur cumque.;"2023-11-21 14:35:43";ixrbxbkyofvx
Molestiae laborum tenetur sed commodi quis sed omnis animi facere.;"2022-10-13 09:16:38";mseuzqdomeeuaoccsq
Voluptates dicta id commodi recusandae ab accusamus recusandae labore illo.;"2023-06-01 17:41:51";uyfqxezujovumhb
Tenetur recusandae error quas.;"2021-09-07 17:05:00";dzaqlblteh
Iure incidunt tempora at nam doloribus.;"2022-11-20 04:57:01";eiawoncwhiqe
Reprehenderit autem adipisci eos pariatur soluta qui repellat voluptatum earum.;"2021-03-23 17:39:57";xiwahgganmcs
Amet architecto recusandae exercitationem quisquam dignissimos.;"2022-11-10 14:56:51";ipuqpaiobxgtzc
Nisi laudantium magnam modi.;"2023-03-06 08:16:05";ucvutbiztngwaiscg
Odit beatae molestias natus assumenda.;"2022-10-13 12:04:46";grojflbzo
Architecto amet suscipit sunt esse doloremque eaque deleniti maiores nisi.;"2023-01-27 00:22:43";ldekflg
Delectus eligendi eos enim cumque perspiciatis dolor a.;"2022-06-19 13:40:43";mrzwdbgppycpl
Distinctio eligendi numquam.;"2022-10-23 11:53:40";splna
Iusto excepturi veniam consectetur.;"2023-07-13 23:46:40";fitrdepeodq
Saepe assumenda doloremque error.;"2021-01-09 19:08:30";equznw
Fugiat ipsum nisi rem culpa deserunt necessitatibus asperiores laboriosam.;"2021-10-08 05:38:05";mjxxurwsmtjzxlm
Veritatis ipsa nihil tenetur ab.;"2021-11-07 02:38:42";vhiielebfnkdemkivj
Cum exercitationem doloribus dicta unde nesciunt quos aspernatur sint.;"2023-05-08 14:19:39";kqrgboymmvxnxzdjtn
Dolores placeat at amet fuga est eaque consequuntur.;"2023-03-21 23:14:09";krngfgrnwikkjckhuxaw
Nemo officia eligendi perferendis illo inventore mollitia ipsum suscipit.;"2021-08-08 09:51:19";fftrxnyrj
