Deserunt ullam tenetur molestias commodi quasi hic officiis.;"2022-07-01 15:15:21";srkhc
Quasi porro reiciendis praesentium aut.;"2021-05-23 10:49:09";yumarylmlvsthnlgo
Culpa quis occaecati beatae blanditiis hic error autem.;"2023-05-20 19:48:39";cduyfffdfjqa
Accusantium nostrum pariatur.;"2023-09-27 10:21:13";dpkphlenez
Minus animi et vitae eaque neque earum.;"2022-06-26 16:08:43";moujmdgommizdieki
Maxime dolore vel distinctio accusantium unde aspernatur voluptatibus doloremque.;"2023-09-06 02:38:21";cmwaduwyhjxcsg
A rerum totam corrupti autem ducimus magni.;"2021-08-02 13:57:04";tlrkjunocxmpihvvugf
Ipsum dolor numquam temporibus sint asperiores corporis voluptate dolorem commodi.;"2021-10-15 05:32:05";bqynjusssknzace
Fugit ratione voluptas.;"2022-08-04 19:32:01";bheqofodxppno
Ipsum eos vel sapiente enim necessitatibus at quos ab.;"2021-05-07 18:07:18";kxrpzdgmghlmm
Culpa minima adipisci dignissimos eaque.;"2021-04-25 06:12:21";ebspx
Vel quibusdam rerum.;"2021-07-22 17:58:49";okymbolsappoloozvaq
Beatae voluptas vel.;"2023-11-03 01:05:38";lnvjyf
Eius voluptate fugiat earum impedit optio in quas mollitia fuga.;"2023-10-26 06:56:27";qjyvvpskslmi
Quas eaque minima quo quis eveniet ad beatae eaque.;"2023-09-11 02:08:11";axjox
Quisquam tempora exercitationem totam.;"2023-01-20 15:24:16";zxrsxlmjnsau
Voluptas in accusantium praesentium vero ipsam.;"2023-11-10 12:49:54";kploglabdncdwmmrmnwe
Ipsam odit fuga quo.;"2022-12-05 04:16:30";ncjubaizynqnfgnc
Ex ut nulla non saepe ab quam.;"2023-05-08 18:01:58";xaaqjdfojdzwuh
Consequuntur animi ducimus.;"2021-09-14 07:24:21";gpaycvgpxtreofthav
Occaecati corrupti maxime delectus nam.;"2021-01-09 02:22:50";fvpinlcryqifsvrbcvg
Nostrum consectetur fugit.;"2023-02-06 12:05:18";hjupuxepsdpugpzirwh
Consectetur numquam repellendus dicta deleniti.;"2022-02-25 12:07:21";zrpyufbkuevuffrqa
Quis excepturi praesentium consequatur odit.;"2022-05-10 16:43:24";bifbk
Cupiditate vel quidem inventore sequi.;"2022-06-22 11:12:21";lnqsonmqtcjlnubjcakz
Minus iusto perspiciatis.;"2022-10-10 12:57:18";fmgngatw
Itaque ea itaque ipsum veritatis distinctio voluptatem.;"2021-05-17 00:00:59";zdavo
Veniam itaque dolores nihil dicta voluptatem pariatur fugit ut.;"2023-04-16 17:47:49";swlidtnilqidzdzl
Sint aliquid repellat modi sunt.;"2021-03-08 11:08:01";apokdfxy
Rem quod excepturi quisquam ipsum.;"2023-06-20 00:25:13";fjsvucrjr
Dolor odit harum distinctio voluptas.;"2023-01-06 23:40:46";waoruntab
Enim temporibus necessitatibus pariatur.;"2022-10-12 20:08:27";nuqdtcwolnbupumdrkl
Sint nemo temporibus sint.;"2023-02-13 23:32:39";yrnyombqurrqixnvgle
Commodi quidem assumenda quibusdam qui.;"2021-07-07 12:35:44";hlpeqw
Sapiente veritatis occaecati recusandae.;"2023-04-17 07:03:50";xgrxhckamtbvwirn
Laudantium itaque commodi esse.;"2023-11-05 08:10:10";dkfecfao
Qui nemo voluptatum quisquam illum harum nostrum numquam nemo natus.;"2023-01-06 22:05:42";dnckgxlqcotvmbp
Ratione quae eius eos iusto ducimus beatae aliquid quas.;"2021-11-08 10:04:53";ihxktwvwhqhlsxcmu
Maxime pariatur vel voluptatum minima.;"2023-02-17 19:03:28";aetfbeepnqqqafarq
Ad eaque ex repudiandae.;"2021-08-18 11:50:01";svniwcvr
Eius omnis at omnis nulla ut autem.;"2023-12-27 06:41:52";ayjlfklvakuryxjt
Necessitatibus vero voluptas libero aperiam odio mollitia saepe.;"2023-06-11 18:04:55";yzgxfeiujba
Repellendus aut cum delectus iure aliquid fuga neque.;"2023-03-15 14:44:32";gytlng
Expedita aliquam labore nam suscipit assumenda earum.;"2023-12-19 11:29:00";omhsxyfi
Consectetur tempore consectetur.;"2023-07-16 09:19:30";udujybnwctaqjlo
Doloremque ipsa voluptatibus nam ipsum ipsum ullam odio architecto esse.;"2022-09-22 00:37:35";cppzsurgy
Maxime perspiciatis aliquam placeat culpa.;"2021-08-01 11:07:10";okxvqdgzvurmn
Pariatur perferendis voluptate.;"2022-05-21 18:02:12";athaqkabwgrajldlkjy
Vel placeat incidunt.;"2022-12-23 17:03:07";sgfglif
Repudiandae natus dolorum provident quam placeat illum reprehenderit ut.;"2023-10-02 05:55:15";piowhmvjqqf
Aspernatur tenetur impedit id cupiditate a.;"2023-10-02 15:10:14";ffolamuflcdxiyaoc
Laudantium accusamus cumque accusamus.;"2021-10-19 07:59:18";cfotfqkzvbh
Architecto ab dolorum ullam dicta in numquam vero cupiditate.;"2022-01-27 14:47:36";fhhpgvbchybgexpyum
Aperiam error provident sequi voluptate porro blanditiis eveniet architecto.;"2022-06-04 01:50:38";ejgzujfmdmhpsqepkl
Nobis sequi et ipsa dolorum architecto amet eligendi.;"2022-07-21 20:35:35";nczksxdtldjiozxa
Ducimus maxime quis perspiciatis.;"2023-06-13 01:09:43";cudbm
Ea distinctio non enim voluptatum nulla hic quas a.;"2023-08-17 20:46:14";nmyvajnxtwssxyaaass
Nisi velit harum perferendis eos delectus.;"2023-12-26 01:50:51";jueuzcrloimzcpyoean
At ducimus dolorum sint inventore reprehenderit ipsam alias ipsa.;"2022-05-22 13:00:04";nygdvayhlrudnnm
Facilis consectetur iure maiores quia iusto magni illum ab.;"2023-12-04 18:50:24";kxmvhbr
Repellat aliquid ab ad voluptatem.;"2021-01-22 00:39:22";ptppgfcd
Earum delectus esse impedit perferendis repellendus maiores repellat.;"2021-02-14 14:22:55";xcezyph
A odio qui minus perferendis.;"2021-07-08 09:21:48";aeagfjzdpievzgftznni
Excepturi eveniet corporis rerum tempora asperiores consectetur.;"2022-09-21 20:53:10";pjzskxdeuvchouku
Reprehenderit beatae doloremque nisi optio quod illum amet eius.;"2022-05-11 13:27:05";qwxctppp
Enim ipsa cum deserunt ipsam sunt optio perspiciatis asperiores.;"2023-01-15 06:27:53";tzhwliywjdzccjdtsj
Neque sunt accusantium nam expedita similique eos ut.;"2021-07-25 00:34:33";nfztdfdadnjs
Ab molestias odit dolor voluptate.;"2023-10-22 23:54:20";xfgfuxnhncqsnioohhfv
Inventore consequatur modi nam architecto.;"2023-09-16 00:42:34";cndthdsst
Amet ipsa eligendi dicta modi exercitationem amet qui numquam.;"2023-09-27 01:19:43";epfuzdyidnpzrpa
In eveniet quaerat.;"2021-02-12 02:45:32";ovnxcymugqapwhghhgw
Alias atque soluta repellendus quod eligendi perspiciatis earum praesentium.;"2021-06-15 18:57:34";qblrpb
Ratione similique facere exercitationem.;"2023-08-16 01:49:02";fywyragoie
Eveniet maxime voluptas impedit illo.;"2023-12-02 08:22:17";herxsryxoh
Consequatur fugiat quia natus enim cum.;"2023-07-20 08:12:26";huuetqbr
Est quas est velit.;"2023-11-20 21:50:16";ytgqfpk
Enim dolore odio totam quasi quae atque omnis nostrum.;"2023-12-23 01:18:05";hmaeulf
Dignissimos rerum sunt eveniet.;"2022-02-17 21:09:46";ixixkruifwmcgnifq
Vitae officia quae.;"2022-02-09 02:03:18";xqjedyljfulacmzv
Modi officiis quaerat porro deleniti rem laboriosam amet.;"2021-01-08 23:59:34";hnrixacjmczzwhcajmse
Tempore quibusdam sapiente a.;"2021-11-12 16:00:40";ielfvjrkij
Officia in nemo magnam impedit id pariatur voluptas labore molestias.;"2021-05-15 16:32:37";ygfvrkfwuvi
Accusantium asperiores sit modi cum.;"2021-11-28 02:59:46";rsvxjhu
Animi perspiciatis veritatis ducimus nobis molestiae assumenda suscipit laboriosam eius.;"2021-08-12 02:55:39";jvrzxr
Deleniti sed est voluptas in tempora.;"2023-10-16 11:20:46";bqsuer
Ab incidunt voluptas omnis vel eaque.;"2023-04-23 07:14:43";mikruyoupsd
Doloribus accusantium ut enim vero odio consequatur.;"2023-07-20 06:29:10";yrovvzgvtzveato
Incidunt pariatur ipsum veniam corporis nihil delectus.;"2021-03-18 02:52:07";xiouoiabrhgfkpwi
Beatae ducimus fugit saepe nesciunt perferendis nemo illo ipsum voluptates.;"2022-06-13 08:05:45";eupaabrizk
Et aliquid nostrum distinctio corporis delectus.;"2023-01-11 15:23:44";wnmzxlprhyyowh
Non atque quia aliquam ipsam similique iure error.;"2022-09-04 22:11:11";tivtgtanqtpp
Error quam eius magni dolor non deleniti voluptas.;"2021-11-07 13:53:17";juzvbuhvgdwqvcxehheo
Ex quis dolores reiciendis veritatis ab.;"2022-07-28 08:13:21";ulmhyqehxa
Ex animi culpa est.;"2023-12-04 22:56:40";ashwmobiylre
Cupiditate tempore reiciendis eos vitae.;"2021-12-24 21:23:54";wdgek
Temporibus exercitationem non quos ullam iure odio.;"2022-07-23 16:47:46";tsmdrfmcrh
Quis laboriosam nihil quasi praesentium quos quas voluptates.;"2022-06-12 11:59:31";mruwnugvnqccnve
Perferendis sequi facere.;"2022-07-09 12:28:40";evnyak
Saepe nemo qui ex veniam nulla doloribus nisi praesentium animi.;"2021-01-09 18:11:11";vmmucdcrwzmujkeqsh
Est voluptatem dolorum cum quo numquam eaque laudantium voluptatibus ducimus.;"2023-08-08 17:49:03";bfrcwlpbgptceqxzf
Earum dolores facilis debitis quas accusamus accusamus impedit.;"2023-05-28 14:44:18";jrncoomglzp
Adipisci sit a laudantium.;"2023-08-04 10:19:45";zrxeeiocdo
Temporibus vitae repudiandae.;"2022-11-26 20:04:58";ofgpc
Consequatur aspernatur error voluptatibus a incidunt eum magnam minus perspiciatis.;"2023-07-14 00:49:13";pxbmsrtosfqecln
Rem hic ipsa consequatur.;"2021-08-23 16:31:38";skqicdbk
Pariatur exercitationem fugiat tempora id quae quod.;"2023-04-07 18:49:02";ypnyqhekncyvku
Mollitia a quod nobis vel.;"2022-03-05 17:19:01";qqehhu
Quibusdam nihil voluptate voluptatum similique.;"2022-08-22 01:12:06";lwidpteopkjrm
Quo voluptas ullam a eum dignissimos.;"2023-06-24 11:01:47";ekmqxl
Sint eum illo molestias fugit.;"2022-12-14 00:02:10";tabwalpfwnngbdjv
Tempora nesciunt voluptate unde nesciunt ab.;"2023-05-02 03:26:35";pzrijdyecvmyfosvkbh
Doloremque eligendi optio consectetur distinctio facilis recusandae harum modi quos.;"2021-05-16 05:58:04";vvtltbhq
Repellendus sequi assumenda mollitia facilis distinctio.;"2022-09-11 09:14:56";fkhcpbzqyd
Minus fugit nemo quisquam debitis odit voluptates perferendis.;"2023-04-15 07:08:29";kvkggxeuxoshfgnlc
At nam dolor soluta architecto porro consectetur dignissimos.;"2021-11-14 18:28:56";jukgiyd
Repudiandae a delectus odio fuga.;"2021-08-20 02:29:37";mtjdqyfkmggkokgneqwy
Minima temporibus vitae in voluptatem alias esse nobis reprehenderit.;"2022-01-21 02:56:53";udlxjluntzskb
Sequi voluptatem iusto deleniti est placeat.;"2023-02-05 07:08:47";beoygigwqzwhzivlgq
Ab velit saepe officiis maxime nam velit provident corporis.;"2021-11-16 23:31:43";gxsswkdzld
Minima nulla laborum accusamus dicta necessitatibus.;"2023-02-01 07:51:30";mtuhh
Dolore ratione praesentium.;"2021-12-26 08:42:22";elgeegvqfgzyhv
Veniam odio laboriosam minima atque.;"2023-10-04 02:55:07";ezbtdnkngvljmamejet
Blanditiis neque incidunt expedita doloremque ipsa provident corporis omnis odit.;"2021-02-21 22:38:28";otfcpcjamguhvmsjg
Architecto neque delectus adipisci.;"2023-02-12 19:58:51";wceyismsoyb
Iusto et illo culpa distinctio veniam facilis nobis.;"2023-07-19 03:00:07";tfualzobmohdba
Illum odio excepturi aut earum voluptas tempore.;"2023-09-02 14:20:06";cwxqiuyq
Porro alias pariatur culpa.;"2023-12-13 10:05:44";nxvlgwibuw
Cum eos voluptas facilis non illo.;"2021-03-15 06:38:19";eoxmb
Modi sunt expedita eum nobis reiciendis dolorum.;"2022-09-26 18:59:08";vckipmcgt
Velit iste aut laboriosam.;"2021-09-28 21:07:55";bueqndcynuxhbp
Aperiam repudiandae nemo veniam odio officia incidunt veniam quae eaque.;"2023-04-08 00:15:27";jvcggvldtnoodkxlzkua
Veritatis libero accusantium fuga expedita quia.;"2023-01-07 11:48:15";dqwrapafndys
Praesentium veritatis nam labore possimus voluptate.;"2023-01-11 09:27:29";lmsqkdvy
Magni natus velit assumenda laborum magnam eius.;"2022-03-12 01:03:19";yatzqigazzymisawgba
Ullam error pariatur vel incidunt eos eligendi esse veritatis.;"2021-06-07 16:29:06";xideurzcovzieszrp
Doloribus consequuntur a inventore inventore.;"2023-05-12 05:39:31";rhpim
Omnis at natus autem iure repellat laborum assumenda.;"2022-03-15 09:46:47";arcqtiyfgjw
Illo sed numquam illum reprehenderit.;"2023-05-14 09:44:43";cxklwpwsgyzihpfcen
Ducimus assumenda numquam vitae quod quasi repudiandae repellendus.;"2023-08-07 03:52:09";ktosnugmxwokjclvlmyn
Asperiores nobis minus libero qui repellendus perspiciatis non tenetur modi.;"2023-05-06 10:57:21";hdeizxwqlpzpssh
Nisi est fugiat repudiandae pariatur est.;"2023-10-02 00:07:15";ohifkdamnzhoy
Debitis harum cumque expedita vel voluptas.;"2021-11-11 19:27:21";jgmhsuckybkbmjtazd
Provident cum id aut necessitatibus fuga delectus praesentium vero eligendi.;"2022-11-09 11:32:27";kxwipuw
Cupiditate iusto possimus a facilis.;"2023-12-28 10:19:22";uzddat
Assumenda veniam cupiditate repellat cum eum velit at autem aliquid.;"2022-01-17 17:17:46";jqksijwnoqawxf
Architecto perspiciatis accusamus.;"2021-02-08 11:05:49";nckkgp
Aperiam numquam laudantium quia quasi recusandae.;"2021-05-26 15:38:41";tjterkjczztujlyy
Ipsam a assumenda deserunt veritatis sint omnis delectus repudiandae ea.;"2021-10-07 10:58:13";vanlkijspkzboiylnh
Adipisci expedita quibusdam.;"2023-06-27 03:41:10";eookajneowrudutvt
Exercitationem veniam ipsam deserunt ex distinctio temporibus maiores dicta.;"2022-10-03 14:34:11";lzfaakglby
Animi voluptatibus magnam reiciendis quo.;"2023-01-04 05:58:06";iouafnstuzpfngrpcxld
Nisi quod eaque non ipsam quibusdam ea beatae corrupti.;"2022-12-28 11:29:18";lylmaebndcunvvacvzl
Officia voluptates nemo occaecati distinctio fugiat ipsa soluta.;"2022-04-19 16:39:16";yqwgmkojukhm
Dicta reprehenderit provident maiores nostrum dolor ad saepe officia.;"2023-07-06 01:54:25";rywgtqqeyyvpxvnklnar
Asperiores ducimus autem.;"2023-04-26 04:19:37";pijlyzzxllkmt
Mollitia quos esse dolorem enim veritatis placeat adipisci doloribus.;"2022-08-07 02:54:24";xwjwzhtx
Culpa voluptates doloremque.;"2023-08-10 01:06:26";mrjeypwdzsbfuc
Accusamus eum illo repellendus quis.;"2022-01-07 09:33:11";quazddynsyhhka
Aspernatur minima expedita sint sed quis dolor mollitia repudiandae quae.;"2022-05-03 03:31:17";kjroymddvjnwcbsuizhv
Eaque libero eos earum quos quaerat incidunt.;"2023-01-13 17:31:12";szdnefvxtxd
Laborum dolorem architecto quae voluptatum.;"2021-08-22 07:49:28";ncnqrjvhvnc
Dolorum ducimus vitae ratione.;"2023-05-08 03:08:20";pagopkzccxczatrknu
Inventore repudiandae ad fugiat in dolores deserunt magni at.;"2021-03-09 20:44:11";behthvbwjzosfmnni
Reiciendis consectetur laborum tempora.;"2021-02-20 06:41:22";fcyrjyylqt
Nulla maiores voluptatem reprehenderit maxime eum nobis.;"2022-04-04 03:23:28";jwmkjtchraw
Dolorem eaque ut blanditiis aut.;"2021-01-14 16:09:04";aftaehhppmxsd
Assumenda dolorem accusantium laudantium repellat.;"2022-05-25 06:01:59";zjlxeieycrlvpx
Rem quas qui maxime ea corporis dicta possimus.;"2022-01-05 02:22:14";rspqnznns
Ipsum delectus dolor vitae ipsum nesciunt.;"2021-06-10 09:55:26";uixfeqqgcq
Aperiam ullam aliquid reiciendis fuga blanditiis perspiciatis adipisci eligendi ducimus.;"2022-05-18 03:57:09";vwcmyzhlbojcnrnscrg
Excepturi error dolore necessitatibus illo harum aut quis voluptas dolores.;"2021-05-02 17:02:33";uqeurfjvvhinatgvx
Dicta id perspiciatis a quisquam temporibus iusto nostrum nobis cupiditate.;"2022-07-27 18:36:06";nlmnuidpevkaeknrecy
Quae sed commodi magni voluptates veniam.;"2022-04-09 01:40:25";tfbjxxdqfw
Ex in optio nostrum placeat.;"2023-01-18 01:01:57";yofitrdw
Magni iste harum esse libero doloribus.;"2022-05-17 11:49:34";rhpwfhbhlxgjyve
Earum error laboriosam delectus nemo quaerat fuga deserunt beatae ipsa.;"2023-05-25 06:58:34";cmtpabyxslqskivmyif
Perferendis quis odio explicabo ullam.;"2022-05-13 21:41:35";wlxfijkzagjefpwlj
Porro consequatur voluptatem sapiente quo omnis cupiditate.;"2022-07-26 08:36:58";ggygpj
Ipsa voluptate ad accusantium.;"2023-12-20 23:45:24";lgkns
Odio dolores laboriosam eos nemo.;"2022-05-04 18:59:28";kquxmbnccprlv
Quas harum id fuga.;"2021-09-22 04:09:01";hueqilacpldb
Non doloremque placeat explicabo.;"2021-08-24 03:07:56";vigkkxecbrdiqephkaki
Explicabo ut tenetur recusandae accusamus.;"2022-10-20 05:51:03";qkshinntxmmrueedi
Expedita quaerat distinctio commodi.;"2022-12-05 23:25:26";mijpxtqsdpcunpwkepai
Sit occaecati optio sit soluta fuga.;"2022-09-17 08:34:59";akjldszjctpprkorhp
Odio quae dicta.;"2023-11-17 07:55:54";ydlfyietlkitjsapxao
Doloremque accusantium labore quod deserunt doloribus optio tempore accusamus animi.;"2023-10-18 20:59:08";mmedawdldmh
Perferendis deserunt sunt consequatur exercitationem molestias.;"2023-09-27 22:19:40";gkjqqblhnirm
Soluta sapiente ea dolorum perferendis.;"2022-04-15 23:37:16";tgepb
Soluta animi aut delectus.;"2022-03-05 16:06:47";vwvfptryupjhudoh
Totam aliquam magni.;"2022-08-25 11:28:35";bifdswdafazzay
Ea exercitationem unde fugit assumenda magnam.;"2022-01-11 20:37:19";hqueyva
Asperiores harum hic commodi sit doloremque.;"2022-04-01 03:14:40";xwtvmni
Doloribus ad commodi quaerat.;"2023-11-10 01:24:55";qhsghkror
Cum velit esse earum optio.;"2022-05-20 07:39:56";ufkedeoygtvbken
Magnam eius assumenda exercitationem magnam.;"2021-11-15 06:55:56";owhiajidv
Atque corporis aspernatur veniam magnam ab.;"2021-06-13 04:51:24";lnbunkqnksffo
Laboriosam placeat optio maxime quasi molestiae.;"2023-12-23 20:04:08";xfiljrdneagpfajkt
Dignissimos numquam explicabo dicta amet omnis et facilis adipisci dolores.;"2023-01-13 18:16:38";yszmna
Sequi iste quis necessitatibus blanditiis voluptate.;"2023-02-20 15:43:03";jrvpiyscbtntkkoxqpr
Nisi modi explicabo dolorem dignissimos dignissimos dolorem.;"2022-07-25 22:28:02";msiikj
Ea consectetur alias pariatur nostrum eius esse molestiae.;"2022-05-22 15:55:07";ihnashiibtmgpyjnk
Nemo laborum dolorem est iure voluptate debitis possimus modi.;"2021-10-02 10:25:26";zcqdaclhkwhnsgidpnnh
Ullam at architecto.;"2021-09-02 02:38:39";riwtfjfnajaxnmvhpbq
Esse corrupti tempore distinctio dignissimos dolorem voluptate aliquam tempore tempora.;"2021-11-15 06:50:51";fsifsueoknacwsqb
Repellendus earum distinctio.;"2021-09-14 17:12:04";hbbkps
Quod cupiditate accusamus eum sunt id quia.;"2023-10-16 14:49:54";vtvkgldy
Animi ducimus tempore nobis reiciendis distinctio voluptatem exercitationem.;"2023-10-28 12:58:35";bqiafzfdqermmq
Consequuntur itaque omnis modi ipsa aliquam mollitia voluptas ea quibusdam.;"2021-10-10 10:18:58";zuwruzyghg
Consectetur dignissimos occaecati ad architecto beatae reprehenderit sed.;"2021-02-02 00:16:46";xnkalbyjdxfnfntuieg
Aperiam dicta reiciendis eos dolorum occaecati alias vitae vero illo.;"2022-06-02 12:55:23";kzzilceqxnqdwgqjzj
Blanditiis aperiam quibusdam.;"2023-11-03 09:00:38";czbubcp
Recusandae sapiente explicabo officiis dignissimos.;"2023-06-06 08:06:34";hlgbfwvuonjgjnydnd
Ullam commodi cumque quod aut enim eum quos.;"2022-08-21 07:30:53";svzrfgdelttg
Cum sit porro porro minima nobis voluptatum ratione.;"2023-04-05 15:28:34";ipnbnjtcatyehduk
Error rem earum inventore adipisci itaque suscipit aliquam dolores.;"2023-01-04 06:55:05";frtfjehngticooh
Amet tempora sapiente cum consequuntur veniam modi.;"2021-12-25 10:29:34";tgjuctu
Saepe libero temporibus odit unde sequi praesentium autem accusantium.;"2023-12-22 17:23:15";uvyqwdualdvzhpthfu
Optio aperiam recusandae.;"2021-01-17 09:27:29";tvdbkhrkuaozxukjj
Non doloribus officia inventore nam unde.;"2021-07-05 13:08:23";wedgsrj
Excepturi asperiores mollitia.;"2022-09-07 20:15:20";mjkiayjm
Dignissimos impedit facilis asperiores repellendus nisi sequi perspiciatis sed.;"2021-03-25 16:31:35";bpjasbhqahxyrypi
Doloremque tempore commodi labore accusamus nihil ipsum.;"2022-09-15 01:59:20";azhafaeoflvzxfgdevg
Animi ea aliquid neque facere nesciunt reiciendis odit.;"2021-04-04 23:44:54";tdcejgceolvxrieea
Aspernatur omnis accusamus eveniet.;"2021-09-19 16:34:52";vgpvethljpq
Unde ad occaecati eveniet.;"2023-10-07 22:42:42";auqqszu
Nisi fuga eos.;"2023-12-07 08:32:01";ygmlbvvrsq
Soluta quisquam ex cupiditate quisquam quasi cumque aliquam.;"2022-09-13 00:33:18";nftqjbiuvtjohdopeiv
Odit ducimus aspernatur voluptatem dignissimos maxime ex porro rem mollitia.;"2021-10-04 23:16:30";rzzfhbuhdtjizbusdy
Nemo iure expedita laborum ratione dignissimos id voluptatem nulla repellat.;"2023-06-25 17:31:50";osjnucmgpenl
Asperiores nostrum repellat voluptatum inventore.;"2023-03-24 14:31:55";ojnkzwxwl
Fugiat accusamus ducimus quos impedit tenetur iusto.;"2023-05-27 12:51:21";xhmcgwmvmrsusbljxtf
Ratione non est.;"2023-07-23 07:35:54";vfiosojrredttpprqcw
Facilis error adipisci atque esse repellat ut quae blanditiis.;"2022-11-12 13:23:58";locntfuabi
Numquam quae nisi esse voluptatum molestias.;"2023-04-01 18:20:50";tmpwvsmllzhqowhfq
Corporis quis nobis.;"2021-01-25 21:52:25";lessxhtisczqkdsy
Neque reiciendis at dolor.;"2023-10-21 12:36:57";zqcwxk
Voluptatem suscipit reprehenderit laborum voluptatem doloribus.;"2021-07-18 23:09:57";coquqyyvwuzjvo
Explicabo officiis vero numquam deleniti eveniet.;"2023-11-12 16:29:37";feefefegkthcondkqea
Aut ad modi provident laudantium incidunt debitis dolorum veniam.;"2022-12-09 14:31:48";suiysa
Vero sequi veritatis asperiores doloremque.;"2021-08-21 05:16:11";bdelunuowpdwqziztaw
Exercitationem libero iusto quidem voluptate voluptates fugit facilis minus.;"2023-01-27 17:51:45";hsgkopwqhrxooc
Suscipit at fugit autem recusandae omnis minima fugit suscipit.;"2021-11-23 09:08:12";ssypugnql
Voluptatum nulla voluptates aliquam quibusdam aperiam quisquam iusto possimus.;"2023-11-22 14:17:28";acqaumudeeplctdm
Laboriosam consectetur eius nobis.;"2023-03-16 13:13:36";zqdrygxcrrddxivox
Unde soluta atque.;"2023-01-11 19:22:23";wpzkhcsewqcmn
Natus quibusdam voluptates quae numquam repellendus mollitia.;"2022-01-11 18:20:06";ybrxfs
Ratione optio illo blanditiis officiis illo accusantium beatae.;"2023-10-05 08:30:26";ehzhzinswhygvocpz
Consectetur fugiat perferendis necessitatibus eum corporis laudantium quas ab.;"2022-09-17 18:16:48";nvpzym
Laborum nobis architecto rerum dignissimos accusamus tenetur adipisci quis.;"2023-04-15 22:32:28";jzkbvehwpfzdsslomrcs
Sit ab ullam iste.;"2021-08-18 09:43:11";pusxyotajbrntmfni
Officia repudiandae a praesentium aliquam sed molestiae harum.;"2023-09-12 11:36:09";jvngwbefocbuv
Animi suscipit corporis soluta alias voluptatem corporis ea.;"2022-02-12 16:23:13";gwfxoagozrisle
Quia explicabo minima eligendi eaque ad sequi sed quisquam harum.;"2022-02-18 14:55:41";ukbchg
Facere est reprehenderit veniam labore.;"2021-11-12 18:20:33";rjcpssdkl
Optio quibusdam sint animi facilis rerum.;"2021-12-10 07:17:27";zvrqwjliyzfwykakyf
Voluptatibus sed aliquid optio dignissimos iusto inventore eveniet vel rem.;"2021-01-02 21:10:23";xkqeejupndxbpjb
Facere occaecati ratione eligendi numquam vel aut ipsa.;"2023-06-05 00:39:39";pxmbvxuertra
Accusamus vel quo similique in ducimus iure.;"2021-05-23 21:00:44";kmxygpckervanzdrstq
Molestias odit iure quae necessitatibus.;"2022-10-16 09:37:31";avtbqxwvelvsa
Hic voluptatibus reiciendis est blanditiis facere distinctio.;"2023-04-17 09:31:20";ylcdnqkz
Dolore quia quia adipisci libero soluta suscipit.;"2022-09-27 15:31:28";ktxby
Beatae id voluptatem eligendi dolorum provident necessitatibus.;"2022-01-25 22:19:47";tiuqmbkuhdcivlq
Quasi sit voluptates quidem adipisci voluptate laudantium eos.;"2023-05-04 14:39:01";izvtywbrndsxzfybi
Ut similique sed.;"2023-05-02 00:12:03";fnqvirznag
Veritatis id culpa labore labore dicta impedit accusantium.;"2022-03-24 05:51:37";tgfkalfedoyjs
Fugiat et atque natus deleniti sint quaerat id.;"2023-06-24 15:52:09";usndxfchqixykbeb
Alias accusamus ducimus harum fuga totam culpa excepturi quod.;"2021-07-06 01:25:51";cdrqz
Labore dicta maxime.;"2023-06-24 21:47:20";vigxwycwsv
Culpa natus et pariatur velit aliquam porro hic exercitationem impedit.;"2021-12-18 00:16:35";giquaufpsxad
Consequatur laboriosam explicabo atque ullam blanditiis.;"2022-08-20 00:01:23";nrsipyyywyhvmoaydbk
Sed voluptatibus adipisci praesentium ipsum repellendus aut.;"2023-01-18 08:34:50";fytqffy
Voluptatum earum neque.;"2022-04-10 03:27:16";kaixfdneso
Similique repudiandae iure harum illum odit tempora fugit numquam ducimus.;"2022-05-14 09:44:02";uicmjuyluyii
Ad iusto ullam animi sint tempore odit eos.;"2023-08-27 05:23:52";mgwxsodobka
Dicta a sunt eligendi vel architecto amet.;"2022-07-28 05:06:47";pbdvqlbfiykpgvb
Laboriosam fugiat ea dolor quis nam excepturi.;"2022-06-22 07:29:34";roouuu
Eaque impedit optio rem error.;"2021-07-09 02:13:01";knjqbqdjj
Necessitatibus delectus reprehenderit distinctio pariatur.;"2021-10-09 07:15:43";rgylwfuemk
Laudantium ipsum dolorum voluptates nulla ab beatae debitis ipsam.;"2023-07-09 05:25:38";yraglrvtvgmzkgc
Quam debitis quia ratione perspiciatis.;"2023-05-13 05:49:01";pysvxmbxrvrnlex
Laboriosam labore illum cumque neque.;"2023-08-22 14:39:53";delcwjgqskfulbwgv
Ipsa placeat pariatur temporibus illum sunt natus saepe.;"2023-10-11 12:56:00";fqywauogq
Ipsa tempore ex tempore enim nostrum.;"2023-12-01 09:52:34";lzgsbnujhwaaaqzak
Natus voluptatem autem dolor fugit rem.;"2021-07-06 19:03:10";efsrpp
Ex placeat est dignissimos maxime.;"2021-01-22 19:13:24";bcniih
Repellat omnis laborum veniam natus non asperiores provident atque.;"2021-03-03 08:22:18";voatypkavbdd
Velit placeat vero consequatur necessitatibus a ad cumque.;"2022-06-10 11:49:28";zbxviwpoy
Maiores libero quidem qui vero nobis repellat sint eos hic.;"2021-06-18 15:41:11";dclcsildpbaisrnjbwq
Amet amet suscipit fugiat officiis cum accusantium iusto.;"2022-09-07 20:26:48";yevkutxnrsnsv
Ipsam atque reiciendis at ad dolor ratione.;"2023-04-11 06:09:09";lgrbzwjjsrvavfwma
Consequuntur reprehenderit beatae esse.;"2021-06-24 04:28:40";vzbkdemsvsdbq
Nihil molestias iure earum occaecati eos.;"2022-07-19 03:20:01";kapckhhbqbhkcrebedrr
Recusandae nostrum quisquam asperiores temporibus pariatur facere eveniet dolores cumque.;"2021-07-25 17:29:46";rfpzyjafgjkvarkxp
Deserunt deleniti distinctio nostrum a id.;"2022-04-10 15:00:59";acvmuxkdpyvdiah
Ad quia blanditiis.;"2022-03-04 09:59:47";xktiyvkijudnngy
Exercitationem suscipit praesentium harum laboriosam aut fugit doloremque.;"2022-07-15 07:31:02";hybootvlrp
Culpa ab quaerat.;"2023-11-07 14:28:15";usqdxsqlyftjttkrqgd
Saepe porro optio.;"2021-03-11 02:37:54";jkrqp
Dolore sed at natus harum esse.;"2023-07-23 09:07:34";rfnhiy
Perferendis distinctio corrupti omnis amet ut voluptates ipsam.;"2023-05-28 16:49:22";mfsoynfsbntripqtzc
Reprehenderit quasi explicabo quae saepe eum.;"2023-02-23 08:59:27";uwmtctiayszujwamojm
Quos rerum minus saepe ipsa nostrum laboriosam facilis.;"2023-07-03 03:30:32";aftrcnt
Itaque consectetur exercitationem dolorem.;"2021-11-22 09:49:23";zdujsidakoemyob
Commodi ab neque ipsa inventore quos.;"2021-02-24 18:12:59";svaamewttso
Similique unde totam quas fugit.;"2021-04-14 21:44:47";mfynjaxewvnzpqdkjw
